Name;Description;Link;Full Content;Who can apply;What to expect;How to apply;Contact;Source URL
Home Hospice  HCA Hospice Care ;We are Singapore s largest home hospice care provider and we support patients with life-limiting illnesses and their families in the comfort of their homes. Our dedicated multidisciplinary healthcare teams are on call round-the-clock  seven days a week  making more than 38 000 home visits islandwide every year. This service is provided at no charge.Our multidisciplinary team comprises doctors  nurses  medical social workers  patient care administrators  as well as trained volunteers  who offer support and care based on their areas of expertise and the particular needs of patients and their families. Also available are the services of a spiritual care counsellor  art therapists and in-house pharmacists. In addition  we offer a 24-hour patient care helpline that is available to patients and caregivers  for round-the-clock assistance.;https   www.sgsocialsupport.com resource ArdrT7jntGW;No Content Found;Please contact the organisation for more details.;Please contact the organisation for more details.;Patient Admission To come under our care  patients need to be referred by their primary physicians to our home hospice or day hospice services. Submit the patient referral form below. Submit Form;"HCA - Central     Leaflet   OneMap   contributors   Singapore Land Authority 705 Serangoon Road  Block A  03-01 @Kwong Wai Shiu Hospital  
S328127 HCA - Ci Yuan Hougang Centre     Leaflet   OneMap   contributors   Singapore Land Authority Blk 662  Hougang Ave 4   01-411 
S530662 HCA Bedok Centre     Leaflet   OneMap   contributors   Singapore Land Authority Blk 23  Bedok South Avenue 1   01-759 
S460023 HCA Hospice Care     Leaflet   OneMap   contributors   Singapore Land Authority 705 Serangoon Road  Block A  03-01
@Kwong Wai Shiu Hospital 
S328127 Monday-Friday from 8 30am to 5 30pm.
Closed on Saturdays  Sundays and public holidays. 6251 2561 Website HCA Loving Heart  Jurong  Centre     Leaflet   OneMap   contributors   Singapore Land Authority Blk 316  Jurong East St 32   01-279 
S600316 HCA Woodlands Centre     Leaflet   OneMap   contributors   Singapore Land Authority Blk 672  Woodlands Drive 71   01-77 
S730672";https   www.sgsocialsupport.com resource ArdrT7jntGW
Home Maintenance Services  Sage Counselling Centre ;Home Maintenance ServicesHMS provides free basic home maintenance services to anyone who is 50 years old and aboveholding a blue CHAS card or on ComCare Assistance Scheme.  The eligibility document must be valid at time of application. RemarksWe do not accept urgent request.The eligibility document must be valid at time of application.We replace faulty item  NOT install new item  and only provides basic materials.Maximum 3 issues per request.E.g. 1 faulty light in living room  1 faulty cistern flushing system  1 leaking kitchen sink.We Offer Basic Services ElectricalHandymanPlumbingThese services are provided by a group of skilled committed handymen  electricians and plumbers who are mostly seniors themselves.;https   www.sgsocialsupport.com resource m9ZpaxHuxeK;No Content Found;HMS provides free basic home maintenance services to anyone who is  50 years old and above holding a blue CHAS card or on ComCare Assistance Scheme.  The eligibility document must be valid at time of application. ;Please contact the organisation for more details.;For organizations who wish to make a referral  please fill up the HMS Request Form and email it back to us at hms@sagecc.org.sg together with a copy of the senior s  NRIC  Front and Back . Can be omitted if Request Form is duly filled by Referral agency. Proof of subsidy Areas to be repaired You may block out the first 4 digits of the NRIC number. Our Staff will contact you within 5 working days. For individuals who seek to engage our services  please approach your nearest Cluster Support  Family Service Centre  Seniors Activities Centre or any equivalent Social Service Agencies  to ask for a referral to us. For enquiry  kindly contact SAGECC at 6354 1191 or click here Download HMS referral form;SAGECC 6354 1191 reception@sagecc.org.sg Website;https   www.sgsocialsupport.com resource m9ZpaxHuxeK
Home Personal Care  Caregiving Welfare Association ;"Home Personal Care  HPC 
Companionship services  eg. befriending  grocery shopping  medication reminders  errand services  etc. 
Personal Care services  eg. personal hygiene - bathing bed bath  grooming  change of diapers and toileting  lifting and transferring  assisting with eating  amp  drinking  etc.   
Exercise and Recreation  eg. assist in simple exercises and mind-stimulating activities 
Medical escort service

For more info and brochures please refer to the website.";https   www.sgsocialsupport.com resource c5xRGRWy9VB;No Content Found;Who should apply  Aged 55 years or older Frail and or homebound seniors We accept referral from  Hospitals Polyclinics VWOs NGOs Clinics  General Practitioners  Self-referral  Consented referral by a representative or service provider on your behalf;Please contact the organisation for more details.;Please contact the organisation for more details.;Caregiving Welfare Association 6466 7996 contact@cwa.org.sg Website;https   www.sgsocialsupport.com resource c5xRGRWy9VB
Home Wellness  FaithActs ;As Singapore faces the problem of an ageing population  more seniors  especially those living alone  will need help maintaining their homes.  Home wellness is one of our key services provided to ensure that our seniors are safe at home. This involves decluttering  cleaning and repairs. In some cases  it may include fumigation  painting and refurbishing with basic furniture and equipment.;https   www.sgsocialsupport.com resource kXLhMZT9cqV;No Content Found;Please contact the organisation for more details.;Please contact the organisation for more details.;Please contact the organisation for more details.;Home Wellness  FaithActs  Website;https   www.sgsocialsupport.com resource kXLhMZT9cqV
HoME   Singapore Red Cross ;Home Monitoring and Eldercare  HoME   is a monitoring system using sensors placed around the home. When unusual patterns are detected or when the user activates the panic button  the Red Cross  call centre is notified immediately. Depending on the situation  community responders or the SCDF  for emergencies  will be dispatched to provide assistance. HoME  is a great help and safety net for seniors living alone  post-surgery patients  wheelchair users and more ;https   www.sgsocialsupport.com resource uafQxCHzmPx;No Content Found;Please contact the organisation for more details.;Please contact the organisation for more details.;Call 6664 0699  or email us at home.plus@redcross.sg;"Singapore Red Cross Society     Leaflet   OneMap   contributors   Singapore Land Authority 6 Fort Canning Rd
 02-08 YWCA 
S179494 Mon - Fri 10am - 5pm 6664 0699 home.plus@redcross.sg Website";https   www.sgsocialsupport.com resource uafQxCHzmPx
Inpatient Services  Kwong Wai Shiu Hospital ;Our nursing homes focus on providing long-term medical and nursing care for the elderly who do not have caregivers to look after them in their homes. Since 2013  we have been providing respite care to patients who need short-term nursing care.;https   www.sgsocialsupport.com resource YgRGDrrAZse;No Content Found;Any elderly who is unable to support himself herself either physically or mentally due to medical conditions and or injury. Any persons with medical conditions that require special nursing care  such as tube feeding  pain relief and wound dressing. Any persons without care-givers  or have no one capable of providing the nursing care required. Any persons whom together with his  her family have undergone means test and are entitled to subsidy.;Please contact the organisation for more details.;Admission is by referral from Medical Social Workers of acute hospitals or polyclinics through the Agency for Integrated Care  AIC    which is a centralised government agency that manages the availability of Voluntary Welfare Organisations  VWO  nursing homes in Singapore. If you or your loved ones are already hospitalized  please speak to the Social Worker at the respective Hospital. Alternatively  you may speak to the Social Worker at your nearest Polyclinic for assistance. The Social Worker at these places will assist you in submitting an application to AIC which will then assess what is best-suited for you or your loved ones and thereafter locate a service provider near you. For more information on care planning  you may visit the AIC website. For more information about our Hospital  please contact our Admission Office at 6422 1238 or email us at admission@kwsh.org.sg Charges To view the full list of inpatient charges  click here .;"Kwong Wai Shiu Hospital     Leaflet   OneMap   contributors   Singapore Land Authority 705 Serangoon Road 
S328127 6422 1238 admission@kwsh.org.sg Website";https   www.sgsocialsupport.com resource YgRGDrrAZse
Jia Ying Active Ageing Centre;We operate two centres. a. JY AAC @ 19 located at Blk 19  Hougang Ave 3  since 2004 b. JY AAC @ 25  Branch  located at Blk.25  Hougang Avenue 3  since 2014 Our Centre provide activities that promote Active Ageing  Befriending Services and Care  amp  Support.Centre Based Activities includes the following   Skills development e.g. I.T. class  Smart Phone savvy   Conversational English class    Handicraft sessions e.g Decoupage  Social interaction e.g. karaoke  games time  Lai Lim Kopi sessions  Eat healthy cooking demonstration  Keep fit activities e.g. Morning dance  Fun Fitt  line dancing  Health monitoring e.g. blood pressure reading    Outings and festive celebrations  Visitation programme to the  at-risk  elderly;https   www.sgsocialsupport.com resource BfvyU6-cqte;No Content Found;Please contact the organisation for more details.;Please contact the organisation for more details.;Please contact the organisation for more details.;"Jia  Ying Active Ageing Centre @ 25  Branch      Leaflet   OneMap   contributors   Singapore Land Authority Blk.25  Hougang Avenue 3   01-442 
S530025 6343 0530 Website Jia Ying Active Ageing Centre @ 19     Leaflet   OneMap   contributors   Singapore Land Authority Blk.19  Hougang Avenue 3   01-187 
S530019 6281 5025 Website";https   www.sgsocialsupport.com resource BfvyU6-cqte
Ju Eng Home for Senior Citizens;The Home provides up to 522 beds for full residential care and is equipped with modern facilities for the physical  emotional and spiritual well-being of the elderly. It houses a large reception hall  recreational  amp  dining rooms  with facilities for dormitory-style living  occupational therapy  physiotherapy  medical consultation and a dispensary. The Home also conducts regular Sunday chapel services for residents and staff.Rehabilitative services are carried out for our residents  reinforced by maintenance therapy to prevent deterioration. Qualified medical and nursing staff  including the services of a psychogeriatrician  are on hand to manage residents with chronic medical conditions.Recreational and social activities are planned by dedicated staff and volunteers to enable the residents to keep in touch with their social and physical environment.Ju Eng Home provides value-added residential services  amp  care for the elderly.;https   www.sgsocialsupport.com resource rgWU8cv9TVb;No Content Found;Admission to the Home is mainly by referral from Agency for Integrated Care  AIC . Any client who is not referred by AIC would be assessed based on eligibility such as  Qualification for Household Means Test Requirement for skilled nursing care needs Availability of other care options For clarification or enquiry  please email to  juenghome@jeh.org.sg;Please contact the organisation for more details.;Please contact the organisation for more details.;"Ju Eng Home for Senior Citizens     Leaflet   OneMap   contributors   Singapore Land Authority 205 Jalan Kayu 
S799436 6484 6890 juenghome@jeh.org.sg Website";https   www.sgsocialsupport.com resource rgWU8cv9TVb
Lakeside Senior Services;"Kaki Kampong Seniors Wellness  KKSW  promotes holistic wellness in seniors aged 50 and above  empowering them to take charge of their lives and well-being. KKSW keeps the kampong spirit alive by encouraging seniors to do good in the community. Active seniors reach out to isolated and vulnerable seniors  strengthening community bonds through peer-to-peer volunteering. Volunteering also helps seniors maintain an active lifestyle and a positive mindset.
KKSW runs interest groups  and organises outings  events  and celebrations for seniors.";https   www.sgsocialsupport.com resource 2pJrtTfaUra;No Content Found;Please contact the organisation for more details.;Please contact the organisation for more details.;Contact lakeside family services at https   lakeside.org.sg contact-us  jurong-west;"Kaki Kampong Seniors Wellness  Jurong East      Leaflet   OneMap   contributors   Singapore Land Authority Blk 302  Jurong East St 32   01-22 
S600302 Kaki Kampong Seniors Wellness Centre     Leaflet   OneMap   contributors   Singapore Land Authority 500 Corporation Road  03-01 
S649808";https   www.sgsocialsupport.com resource 2pJrtTfaUra
Ling Kwang Home for Senior Citizens;;https   www.sgsocialsupport.com resource gmmwKc-qBhF;No Content Found;Please contact the organisation for more details.;Services Residential Care It is our commitment as a nursing home to serve the community by taking care of the elderly who are not being able to be cared for by their loved ones at home for various reasons. Our multidisciplinary team includes nurses  medical doctors  allied healthcare professionals and ancillary staff. Integrated Home and Day Care The Integrated Home and Day Care  IHDC  centre at our Home provides support services to Seniors who wish to remain living in the community  in the comforts of their homes with their loved ones. Generally  IHDC clients attend the centre on weekdays where they receive personal care  medical  nursing and rehabilitation support by our multi-disciplinary team and are also able to partake in outings and gatherings. Day Care Our Day Care programme serves elderly living in the vicinity during weekdays. Clients either come individually or are accompanied by a caregiver. Trainings are given to teach Seniors on simple rehabilitative exercises for them to carry out when they are at home.;Frequently Asked Questions Q1. What is the process for admission to a nursing home  Ans  We serve clients residents who are mostly referred by the Agency for Integrated Care  AIC . AIC and the Medical Social Worker  MSW  of the restructured hospital polyclinic where the elderly is receiving treatment will jointly assess the elderly for admission to a nursing home. The referral process is completed only when the elderly is accepted for admission to a nursing home. Q2. Where can I find out more information about admission to a nursing home  Ans  For more information on the AIC referral process or the status of your referral application  kindly refer to the MSW at the hospital polyclinic where your elderly is receiving treatment for better assistance. Please click on the links below for general info on the following topics  Placement at a nursing home with government subsidy  https   www.aic.sg care-services nursing-home Care options in the community  https   www.aic.sg care-services Q3. Does LKH admit any residents who are not referred by AIC  Ans  LKH has a limited number of non-subsidised beds for those who are not referred by AIC. Private residents are accepted strictly on a case-by-case basis. We encourage family members to engage with us and welcome feedback for continuous improvement.;"Ling Kwang Home for Senior Citizens     Leaflet   OneMap   contributors   Singapore Land Authority Ling Kwang Home for Senior Citizens
156 Serangoon Garden Way 
S556055 Mon to Fri 
9 00am to 5 30pm
Sat

 For counter payment and general enquiries only  
9 00am to 1 00pm 6287 5466 contactlkhsc@lkhsc.org.sg Website";https   www.sgsocialsupport.com resource gmmwKc-qBhF
Maintenance Day Care  Presbyterian Community Services ;PCS Maintenance Day Care  MDC  provides Singaporeans and Permanent Residents aged 60 years and above with a full-day care programme which aims to promote ageing in place for service users in our community.We provide our service users a secure environment in which to spend the day or part of the day. Our activities are designed to promote memory  social interactions  music  and maintenance of activities of daily living aligned with our service objectives  routine-based regimes created for our service users as enablers to ageing in a dignified and graceful experience.Through the guiding principles of PCS MDC Individualised Care Plan  ICP   suitable maintenance exercises  maintenance regimental activities that stimulates both mental and physical health are helpful to prevent or delay cognitive decline.;https   www.sgsocialsupport.com resource L2Gcpn4EAvb;No Content Found;Please contact the organisation for more details.;PCS Hannah Maintenance Day Care Meals  Provides breakfast  lunch and 2 tea breaks. Transport  If required  can be arranged. Please note additional charges will apply. Presbyterian Eldercare @ Potong Pasir Meals  Provides breakfast  lunch and 2 tea breaks. Transport  If required  can be arranged. Please note additional charges will apply.;Please contact the organisation for more details.;"Mr Yang Lee Fook  PCS Hannah Maintenance Day Care      Leaflet   OneMap   contributors   Singapore Land Authority Blk 21 Toh Yi Drive  02-601 
S590021 Monday - Friday  7am - 7pm
 closed on Sundays and Public Holidays  8053 6775 hannahmdcenquiry@pcs.org.sg Website Mr Yang Yam Seong  Presbyterian Eldercare @ Potong Pasir      Leaflet   OneMap   contributors   Singapore Land Authority 108 Potong Pasir Avenue 1   01-488 
S350108 Monday - Friday  7am - 7pm
 closed on Sundays and Public Holidays  8033 4700 peppmdcenquiry@pcs.org.sg Website";https   www.sgsocialsupport.com resource L2Gcpn4EAvb
Man Fut Tong Nursing Home;;https   www.sgsocialsupport.com resource E8PeDKyrYWt;No Content Found;For subsidised admission  applicants must meet the following admission criteria  Require medical and nursing care. Have tried all other care options  such as hiring a domestic worker  or using day care  home care and other services. No available family members caregivers to provide the level of care required at home. Referred by Agency for Integrated Care  AIC  . Meet Means Test Criteria. Non-alcoholic or drug addict and dialysis cases. Non-subsidised admission For non-subsidised admission for patient needing nursing care  kindly contact us for more information.;24-hr Nursing   Clinical Care The Home has a dedicated  trained and experienced team of more than 80 Care Staff comprising Nurse Manager  Staff Nurses  Enrolled Nurses  Nursing Aides and Health Care Assistants to provide quality nursing care. They are responsible for identifying  planning  developing  implementing and evaluating professional standards of holistic nursing care practice in the Home. Infection Control is a key factor to reduce morbidity and mortality among the residents and staff. Education and strict compliance to infection control guidelines and practices through in-house regular audits are a regular feature under the direct supervision of the Director of Nursing. Residental Care Rehabilitation At Man Fut Tong Nursing Home  our commitment lies in improving the quality of life for our residents. Our Occupational and Physiotherapy team offers personalized therapeutic  preventive  and rehabilitative treatments for individuals  as well as group therapy sessions. Medical Social Service Medical Social Services  MSS  Department in Man Fut Tong Nursing Home plays an integral part in the Home s effort in providing holistic care to our residents for quality of life. As part of the Multidisciplinary Team  doctors  nurses  and rehabilitation team   we attend to the psychological  emotional  physical  and financial needs of the residents and their families. We work with the Agency for Integrated Care  AIC   hospitals  voluntary welfare organisations  VWO  and community organisations  They attend to the social  environmental  financial and emotional needs of patients and families across the continuum of care offered by the various programmes and services Professional Medical Services The Medical team comprises our Visiting Medical Officer  Visiting Consultant Geriatrician and Psycho-Geriatrician.;Application Process Before making an application for subsidised admission to a nursing home  speak to a Medical Social Worker at any of the Public Healthcare Institutions to explore the various care options available. If the applicant is eligible for subsidies at a nursing home  the Medical Social Worker will assist to submit an admission application to Agency for Integrated Care  AIC    which is the central agency that processes all subsidised admission applications. Once the application is processed by AIC  it will be routed to nursing homes for consideration. You can also visit the Singapore Silver Pages to find out more about the various types of eldercare services available.;"Man Fut Tong Nursing Home     Leaflet   OneMap   contributors   Singapore Land Authority 20 Woodlands Street 82 
S738507 3157 1151 mft@mft.org.sg Website";https   www.sgsocialsupport.com resource E8PeDKyrYWt
Medical Escort Transport  Sunlove Abode For Intellectually-Infirmed ;The programme started in 1997 for the purpose of providing accessible and affordable services to assist the frail and home-bound elderly.;https   www.sgsocialsupport.com resource w2quWdrCpD6;No Content Found;Please contact the organisation for more details.;Please contact the organisation for more details.;Please contact the organisation for more details.;"Sunlove Abode for Intellectually-Infirmed     Leaflet   OneMap   contributors   Singapore Land Authority 70 Buangkok View 
S534190 6386 9312 6387 3593 sunlovehq@sunlove.org.sg Website";https   www.sgsocialsupport.com resource w2quWdrCpD6
Moral Home for the Aged Sick;Moral Home is a nursing home with 235 beds capacity  out of which 35 are dedicated to residents with dementia. nbsp  We strive to facilitate ageing gracefully in the community. To achieve this  the Nursing Home focus on person-centered care approach that supports and caters to the medical  physical  psychosocial and emotional aspects of our residents in a safe and tranquil environment.Aside from quality long term care  the team has introduced cognitively engaging and therapeutic activities  which are popular with our residents. nbsp  These include individual group based sensory stimulation activities like drumming  music  food and art craft. Since early 2023  with Safe Management Measures  SMM  in place  the care team has gradually reintroduced all-time favorite activities like theme-based outings and weekend social interaction with YOLDEN and resident volunteer group - Moral Angels. All care staff in MH are required to be CPR   AED   BCLS trained and certified.  nbsp All staff participates in pandemic and fire preparedness drills at least twice yearly. nbsp  The Home ensures its staff receives continual professional upgrading throughout their employ with the Home.;https   www.sgsocialsupport.com resource KnHDedKRScN;No Content Found;Please contact the organisation for more details.;Please contact the organisation for more details.;Download Admission Policy;"Moral Home for the Aged Sick     Leaflet   OneMap   contributors   Singapore Land Authority No. 1 Jalan Bilal  Off Bedok Road  
S468854 6442 2268 info@moral.com.sg Website";https   www.sgsocialsupport.com resource KnHDedKRScN
