Name;Description;Link;Full Content;Who can apply;What to expect;How to apply;Contact;Source URL
Caring Heart Program  Nam Hong Welfare Service Society ;Caring Heart Program is one of the main programs in Nam Hong Welfare Service Society. It was initiated for the elderly in 2014 after discovering that there were many seniors either staying alone with no family support or struggling to make ends meet. They required support and assistance in many areas to maintain a reasonable quality of life.Afterlife CareAs the number of elderly aged 65 or older who live alone rises  the demand for afterlife care rises especially for the disadvantaged. Many worry about the state of their affairs beyond their lifetime.Since 2014  Nam Hong Welfare Service Society provides pro bono funeral service for nbsp elders who have no dependents and are from low-income backgrounds nbsp so that they can continue living with a peace of mind and ease of heart.Our beneficiaries are from nbsp different racial backgrounds and ethnic groups  and we support funeral services of nbsp all religions.Ration and Home visitsCaring Heart Volunteer Corp conducts nbsp periodic home visits to deliver ration and subsistence  while offering care and assistance nbsp to the disadvantaged elderly struggling to make a living at the edge of the society. Ration and cash handouts are also distributed to these elderly annually during festive seasons through organised dinners.;https   www.sgsocialsupport.com resource QnWVH2cfDS6;No Content Found;Please contact the organisation for more details.;Please contact the organisation for more details.;Please contact the organisation for more details.;"Caring Heart Program  Nam Hong Welfare Service Society      Leaflet   OneMap   contributors   Singapore Land Authority Blk 111 Yishun Ring Road  01-375 
S760111 6257 9192 cares@namhongwelfare.sg Website";https   www.sgsocialsupport.com resource QnWVH2cfDS6
COPE  City Harvest Community Services Association ;The COPE programme was initiated by Southeast CDC in 1999 as a befriending programme reaching out to the elderly residing in HDB estates  ensuring that while they are living independently  they are not socially isolated.COPE volunteers reach out to some 500 silvers staying within 21 blocks in Mountbatten estate and 10 blocks in Tampines North.In 2022-2023  we aim to recruit enough volunteers to visit these seniors at least once a month.;https   www.sgsocialsupport.com resource 3AKuxGJ5GsZ;No Content Found;Please contact the organisation for more details.;Please contact the organisation for more details.;Please contact the organisation for more details.;"COPE  City Harvest Community Services Association      Leaflet   OneMap   contributors   Singapore Land Authority 12 Pine Close   01-85 
S391012 Website";https   www.sgsocialsupport.com resource 3AKuxGJ5GsZ
Day Care Service  Apex Day Rehabilitation Centre For Elderly ;The Day Care program features different activities each day that includes a range of activities and services such as meal preparation  medication management  physical and occupational therapy  recreational activities  and socialization.The goal of the day care program is to provide the necessary support and assistance to elderly to help them maintain their independence  improve their overall well-being  and prevent social isolation.;https   www.sgsocialsupport.com resource EFQBATE4w76;No Content Found;Please contact the organisation for more details.;Please contact the organisation for more details.;Contact them through the website - Apex Day Rehabilitation Centre For Elderly;"Apex Day Rehabilitation Centre For Elderly     Leaflet   OneMap   contributors   Singapore Land Authority Block 119 Bukit Merah View 
 01-85 51 
S152119 Mondays to Fridays  8 00 am to 5 30 pm
Closed on Saturdays  Sunday and public holidays. Website";https   www.sgsocialsupport.com resource EFQBATE4w76
Day Hospice  HCA Hospice Care ;Our day hospices see to our patient s needs away from home  catering to patients who are relatively mobile and do not require 24-hour nursing assistance. Patients spend a part of the day at our centre  offering respite to caregivers. Various activities are organised by our staff and volunteers to keep our day hospice patients occupied and allow for social interaction.These activities include but are not limited to  light exercises and physiotherapy  music therapy  art and craft sessions  pet-assisted therapy and outings to places of interest.;https   www.sgsocialsupport.com resource 4kZcAhTwhke;No Content Found;Please contact the organisation for more details.;Please contact the organisation for more details.;Attendance at our day hospices  including two-way transport  meals and activities are provided at no charge. To attend our day hospice  patients have to be referred to HCA by their doctors  who should complete a patient referral form  or be referred by our home hospice team. Submit Form;"Kang Le Day Hospice     Leaflet   OneMap   contributors   Singapore Land Authority Blk 2  Marsiling Drive  01-21 
S730002 Website Oasis@Outram Day Hospice     Leaflet   OneMap   contributors   Singapore Land Authority 10 Hospital Blvd   02-01  Outram Community Hospital 
S168582 Website";https   www.sgsocialsupport.com resource 4kZcAhTwhke
Dorcas Home Care Service  Presbyterian Community Services ;Supports frail and homebound Singaporeans and Permanent Residents aged 55 years and above to age-in-place through home help services such as our Medical Escort  amp  Transport  MET   Meals On Wheels  MOW   and Interim Caregiver Service  ICS .Our Programmes Meals on Wheels  MOW We provide meal deliveries to homebound seniors who are unable to buy and prepare their own meals and do not have a caregiver to help them to do so. Our staff and volunteers check on their well-being while making their daily deliveries.Medical Escort and Transport  MET We provide escort services for frail elderly who have difficulty getting to their medical appointments on their own. Our dedicated home care staff accompany them on this journey to ensure their health care needs are met. Our vans are also equipped with a wheelchair-accessible ramp and power lift.Interim Caregiver Service  ICS We provide personal home care for seniors during the transitional period between their discharge from hospitals and until long-term arrangements  such as the arrival of a helper or a daycare placement  are in place.;https   www.sgsocialsupport.com resource trStejZpE28;No Content Found;Singapore Citizens or Permanent Residents Aged 55 and above Living alone or with another frail caregiver  and is without a regular caregiver during the day We serve the residents of the southwest district  covering  Queenstown Commonwealth Clementi Buona Vista West Coast Jurong and North-East Region  MET only ;Charges Applicants will be subjected to a means-testing procedure to determine how much subsidy they qualify for. Application Procedure Applicants are referred by the medical social workers to the Agency of Integrated Care  AIC  before they are channelled to us for assessment.;Please contact the organisation for more details.;"Michael Foo     Leaflet   OneMap   contributors   Singapore Land Authority Blk 105 Jalan Bukit Merah  01-1912 
S160105 Monday - Friday  8.30am - 5.00pm
 closed on Sundays and Public Holidays  6377 5183 dorcsashcs@pcs.org.sg Website";https   www.sgsocialsupport.com resource trStejZpE28
ElderAid  Singapore Red Cross ;ElderAid is a befriending and wellness programme that reduces vulnerability and enhances resilience  to achieve a community ageing-in-place. Every fortnight  our community volunteers conduct befriending home visits to engage seniors on their needs and to reduce vulnerability. Whenever there are unmet needs  the volunteers will help to direct the seniors to appropriate social services. ElderAid opens doors to various assistance schemes that are already available in the neighbourhood  as well as signature Red Cross services such as Community FirstAid  FoodAid  and TransportAid. In addition   community volunteers conduct regular social calls and recreational wellness activities for seniors living alone.;https   www.sgsocialsupport.com resource cMs-beFYGfz;No Content Found;Elders who live on their own;Please contact the organisation for more details.;Contact Red Cross through phone   65 6664 0500  or email  community.resilience@redcross.sg ;"Singapore Red Cross Society     Leaflet   OneMap   contributors   Singapore Land Authority 6 Fort Canning Rd
 02-08 YWCA 
S179494 Mon - Fri 10am - 5pm 6664 0500 community.resilience@redcross.sg Website";https   www.sgsocialsupport.com resource cMs-beFYGfz
Elderly Outings  YWCA ;YWCA s Elderly Outings are an offshoot of its mainstay Meals-on-Wheels for Elderly Persons with Disabilities programme.Since 2013  YWCA has aimed to meet not only the physical but also the socioemotional needs of our elderly beneficiaries through organised outings every alternate month. These outings range from Movie Lunches featuring local Cathay film classics in collaboration with the Asian Film Archive held at the YWCA Fort Canning Visits to sites of cultural significance such as the Malay Heritage Centre and National Museum Places of interest like the Esplanade and Singapore Flyer And scenic spots such as Gardens by the Bay and Botanic Gardens.By providing such supplementary services  YWCA seeks to create opportunities for elderly living alone in rental flats to socialise  improve their wellness by being out of the house  and to find renewed purpose and engagement by interacting and sharing their lived knowledge with volunteers and other elderly alike.Most of the programmes are extended to wheelchair-bound elderly and disabled and all are free for participating Meals-on-Wheels beneficiaries.;https   www.sgsocialsupport.com resource YSmNuK-ExE8;No Content Found;Please contact the organisation for more details.;Please contact the organisation for more details.;Please contact the organisation for more details.;"Young Women s Christian Association     Leaflet   OneMap   contributors   Singapore Land Authority 254 Outram Road 
S169051 6223 1227 ywcavolunteer@ywca.org.sg Website";https   www.sgsocialsupport.com resource YSmNuK-ExE8
Elderly Programme  EQUAL ;This is a psycho-social care programme that aims to improve the emotional well-being and mobility of seniors in institutionalised homes through a combination of Person-Centred Care and Animal-Assisted Learning.;https   www.sgsocialsupport.com resource SSYeR8eyq7q;No Content Found;Elderly aged 65 and above  especially those with dementia and depression  living in institutions or the community.;"Programme Structure
10 weekly sessions
Each session is 2 hours long
Weekdays or weekends";Please contact the organisation for more details.;"EQUAL     Leaflet   OneMap   contributors   Singapore Land Authority 100 Jalan Mashhor 
S299177 6904 0422 info@equal.org.sg Website";https   www.sgsocialsupport.com resource SSYeR8eyq7q
Eldersitter Programme  Caregiving Welfare Association ;"We are looking for passionate groups who can commit to our befriending programme. 
Volunteers would be trained in-house and be assigned to households fortnightly. The aim of the programme is to provide companionship and engagement to our seniors at home. 
If you are keen to find out more about our  Eldersitter programme   please feel free to contact our friendly staff at 6466 7996 or email us at contact@cwa.org.sg";https   www.sgsocialsupport.com resource SdRFA86YyhC;No Content Found;Please contact the organisation for more details.;Please contact the organisation for more details.;Please contact the organisation for more details.;Caregiving Welfare Association 6466 7996 contact@cwa.org.sg Website;https   www.sgsocialsupport.com resource SdRFA86YyhC
Enhancement for Active Seniors  EASE   AIC ;"Falls are common causes of elderly injuries at home. To help you or your loved one to move around safely at home  consider installing special tools around the house can help prevent falls.
The Housing and Development Board introduced Enhancement for Active Seniors in 2012  to subsidise home modifications so that older residents can live at ease in their own homes.
This is what you can install in your flat through the EASE programme 

Slip-resistant treatment to floor tiles in up to two bathrooms or toilets
Grab bars in the flat  eight or 10 grab bars for the first toilet  and six grab bars for the second toilet 
Up to five ramps in the flat  and or at the main entrance   if it is doable";https   www.sgsocialsupport.com resource Aw8LwpX4Pcf;No Content Found;"How to Qualify If you are applying for EASE  these are the criteria 
Either You must be a Singaporean flat owner  with a member of your family living with you who is 65 years and older.
Or You must be a Singapore flat owner  with at least one household member between the ages of 60 and 64  who needs help with one or more of the Activities of Daily Living. These include  Washing Dressing Feeding Toileting Mobility Transferring";Please contact the organisation for more details.;Method 1 If your block of flats is undergoing HDB s Home Improvement Programme  HIP   you can apply for EASE through this programme. Note that in this case  residents do not need to meet the age criteria to be eligible for the upgrades. Method 2 Visit EASE  Direct Application  e-Service Method 3 Via Mobile@HDB Method 4 Download and complete the forms provided on the EASE  Direct Application  e-Service webpage Complete this Assessment Report and get a doctor to endorse this report;Agency of Integrated Care Website;https   www.sgsocialsupport.com resource Aw8LwpX4Pcf
Free Haircut Service for Senior Citizen  Ascending Hope Community Services ;"Free Haircut Service for Senior Citizen
Time  Sunday 10am-1230pm  monthly
In collaboration with renown hairstylists  Eddie Tan and Vince Toh of Xpect hair salon. They also head a group of trained volunteers from Ascending Hope  providing them with the skills to provide senior citizens of Whampoa with free haircut services.";https   www.sgsocialsupport.com resource sk7Pe3Z5zPS;No Content Found;Please contact the organisation for more details.;Please contact the organisation for more details.;Please contact the organisation for more details.;"Ascending Hope Community Services     Leaflet   OneMap   contributors   Singapore Land Authority 37 Jalan Pemimpin   07-03 Mapex Building 
S577177 8876 2225 admin@ascendinghope.org Website";https   www.sgsocialsupport.com resource sk7Pe3Z5zPS
Geylang East Active Ageing Centre  Geylang East Home for the Aged ;Formerly known as The Senior Citizens Recreation Centre  from 1986 to 1995   to Neighbourhood Centre  from 1995 to 2005   to Geylang East Neighbourhood Link  from 2005 to 2011   to Harmony Activity Centre  from 2011 to 2022   and Geylang East Active Ageing Centre  from 1st April 2022 onwards   the Centre has evolved with the changing needs of our society and our local community.;https   www.sgsocialsupport.com resource XwAcpURNyks;No Content Found;Membership is free for Seniors aged 60 years old and above Staying within Aljunied Crescent Boundary For seniors living outside service boundary  caregivers and helpers  annual membership fee is SGD  20.00.;Services Geylang East Active Ageing Centre Formerly known as The Senior Citizens Recreation Centre  from 1986 to 1995   to Neighbourhood Centre  from 1995 to 2005   to Geylang East Neighbourhood Link  from 2005 to 2011   to Harmony Activity Centre  from 2011 to 2022   and Geylang East Active Ageing Centre  from 1st April 2022 onwards   the Centre has evolved with the changing needs of our society and our local community. Facilities HUR health and fitness exercise equipment Foot reflexologist Services Food ration distribution Ad-hoc housekeeping   maintenance Ad-hoc medical escort Activities Programmes Morning exercises   Chair yoga Bingo  Rummy-O Art   Craft One-Day-Tour   outings Block party Festive celebrations;Please contact the organisation for more details.;"Geylang East Active Ageing Centre  Geylang East Home for the Aged      Leaflet   OneMap   contributors   Singapore Land Authority 98 Aljunied Crescent  01-411 
S380098 Monday   Friday  8 30am   5 30pm
Closed on Weekends and Public Holidays 6842 6643 ge.aac@geha.org.sg Website";https   www.sgsocialsupport.com resource XwAcpURNyks
Health-Oriented Ageing  O Joy ;Launched in 2013  our Health-Oriented Ageing  HOA  program caters to individuals aged 50 and above  delivering activities five days a week from Monday to Friday mornings. Due to the increasing number of participants  we ve relocated the program to the multi-purpose hall of Geylang West Community Club  accommodating 80-100 seniors simultaneously. The program comprises three components Exercises to maintain physical activity and delay mobility loss Art activities led by Professional Instructors  Movement  amp  Dance  Taichi  Singing  Angklung  Arts  amp  Crafts  scheduled throughout the week to stimulate cognitive functions and deter dementia progression  andLunchtime sharing sessions  optional dependent on lunch sponsors  availability and not daily . nbsp Beyond enhancing physical well-being  HOA fosters a sense of community among seniors  providing a supportive social environment. Our vigilant team of professionals closely monitors participants for any signs of emotional or psychological concerns  ensuring timely intervention. Enrolment is open to any senior interested in becoming a participant of the HOA program.;https   www.sgsocialsupport.com resource WUAZfwFmSPS;No Content Found;Please contact the organisation for more details.;Mon to Fri Lala Exercise      Lala exercise offers elderly individuals gentle stretching and weight exercises to stay active and prevent mobility deterioration.   Monday Movement   Dance     Movement and dance provide the elderly with a joyful experience  dancing to familiar rhythms and oldies they love. It s a delightful way to have fun while staying active and engaged. Tuesday Taichi          Taichi improves strength and balance for the elderly  fostering a serene inner being that enhances their mental well-being. Wednesday Singing     Acapella Singing for the elderly is not just about enjoying your favorite oldies. It s a therapeutic exercise that exercises your lung  throat  and vocal muscles  preventing deterioration in old age for a happier and healthier lifestyle. Thursday Angklung    Angklung playing for the elderly enhances hand-eye coordination and concentration. This engaging activity not only fosters mental acuity but also provides a joyful platform for social interaction  promoting a sense of well-being among participants.   Friday Arts   Crafts    Therapeutic arts   crafts foster creativity and cognitive stimulation  providing a joyful platform for self-expression  and enhances overall well-being and a sense of accomplishment in a supportive environment.;Please contact the organisation for more details.;"Health-Oriented Ageing  O Joy      Leaflet   OneMap   contributors   Singapore Land Authority Multi-Purpose Hall 
Geylang West Community Club
1205 Upper Boon Keng Rd 
S387311 Monday to Friday

10.15 am to 12 pm 6749 0190 hello@ojoy.org Website";https   www.sgsocialsupport.com resource WUAZfwFmSPS
Hey  You Got Mail ;"Hey  You Got Mail  is a student-led initiative dedicated to spreading joy and countering the effects of social isolation  especially among the elderly  through the creation and distribution of high-quality  handmade cards. This thoughtful endeavor invites individuals to send personalized cards to loved ones or communities they wish to support  fostering a sense of connection and warmth. The initiative goes beyond just card-making  it actively promotes volunteerism  encouraging participants to engage in a variety of creative activities  such as designing  drawing  and even dancing  to contribute to their noble cause.
In collaboration with schools  corporations  and other organizations  Hey  You Got Mail  orchestrates meaningful projects aimed at tackling the often overlooked issue of social isolation  an issue that has been intensified by the COVID-19 pandemic. Their efforts in reaching out to seniors are not limited to the joy brought by receiving a card but also serve as an engaging invitation for the elderly to partake in a range of activities alongside the younger generation. This integration of generations is realized through organized outings to scenic locations like the Botanic Gardens and participation in unique cultural experiences  such as kueh-making workshops.
By using card-making and distribution as a gateway  Hey  You Got Mail  not only delivers messages of love and support but also bridges the gap between the young and the old. This innovative approach fosters intergenerational relationships  encourages cultural exchange  and provides the elderly with opportunities to break out of isolation and engage in enriching experiences. Through these shared activities  the initiative cultivates a community spirit  encouraging inclusivity and understanding across different age groups  thereby making a significant impact on combating loneliness and social isolation.";https   www.sgsocialsupport.com resource xCtyddQ3buB;No Content Found;Please contact the organisation for more details.;Please contact the organisation for more details.;Please contact the organisation for more details.;Hey  You Got Mail  admin@heyyougotmail.com Website;https   www.sgsocialsupport.com resource xCtyddQ3buB
Home Care  Yong-en Care Centre ;Attentive Health MonitoringMedication non-compliance  if left unchecked  can result in medical complications  fall risk and hospital re-admission. Our attentive and vigilant healthcare professionals carefully pack daily medication and closely monitor our seniors to prevent any of this from happening.Quality Care in The Comfort and Stability of HomeOur trusted Home Care Services include dressing of wounds  change of and proper care for the feeding tube  urinary catheter and other nursing and rehabilitative procedures our seniors may require. We also monitor their blood pressure and blood glucose levels closely and will alert the doctor should the need arise.Personal Healthcare AdvocateWe stay on top of all our seniors  medical and health needs. As an informed advocate  we update doctors on their progress and also discuss their evolving health needs and concerns for a more holistic approach to providing better care.Health Education for Seniors  amp  CaregiversAs veterans in the provision of home care services  our healthcare professionals are equipped and trained to provide basic health education for our seniors and their caregivers. By establishing an open channel of communication with caregivers and caregiver training  our seniors will get the care and comfort they need to age in place.;https   www.sgsocialsupport.com resource gWpTdjtGmDZ;No Content Found;Eligibility Criteria Everyone who applies to Yong-en Home Care is subject to an assessment of eligibility and suitability for the services we offer. This is based on the admission criteria below  Frail Homebound seniors with chronic conditions or disabilities who require continuing or long term medical care. Frail Homebound seniors with chronic conditions or disabilities who require specific nursing care procedure s  that can only be provided for by a trained nurse.;Home Care Fees Singaporean Citizens Government Subsidies are subjected to eligibility for Household Means Testing and ranges  0 -80   Home Nursing From  12.40    62.00  per home visit  after government subsidy Home Medical From  21.60    250.00  per home visit  after government subsidy Permanent Residents Government Subsidies are subjected to eligibility for Household Means Testing and ranges  0 -55   Home Nursing From  27.90    62.00  per home visit  after government subsidy Home Medical From  60.30    250.00  per home visit  after government subsidy;Referrals can be raised via Agency for Integrated Care  AIC   the central coordinating body for the placement of clients to Intermediate-Long Term Care  ILTC  services  including home care . Agency of Integrated Care  AIC  Yong-en Care Centre;Home Care  Yong-en Care Centre  mail@yong-en.org.sg Website;https   www.sgsocialsupport.com resource gWpTdjtGmDZ
