Name,Description,Link,Full Content,Who can apply,What to expect,How to apply,Contact,Source URL
Renal Friends (KDF),"Throughout their time here, KDF ensures that our patients are able to receive support in various forms, including support for their mental wellbeing. Our patient support group, Renal Friends, was initiated in 1997 by KDF’s Medical Director, A/Prof Lina Choong, to cater to the emotional and psychological needs of dialysis patients and their families.
Their activities include:

Befriending kidney patients in distress
Organising social activities
Organising educational talks and seminars

With these activities, the group aims to enhance interaction, mutual sharing and support, and increase knowledge and awareness of kidney disease amongst patients and their families.",https://www.sgsocialsupport.com/resource/7-WWDPkUzvW,No Content Found,Please contact the organisation for more details.,Please contact the organisation for more details.,Please contact the organisation for more details.,Renal Friends (KDF) 6559 2630 enquiries@kdf.org.sg Website,https://www.sgsocialsupport.com/resource/7-WWDPkUzvW
SAAC Parent Support Group (Autism),"SAAC’s Parent Support Group (PSG) seeks to increase quality of life for families with people with autism, by enhancing family relationships and families’ socio-emotional well-being.
Besides organising regular monthly meetings and talks, the group actively spearheads projects to equip families with members with autism to lead meaningful lives and engage in mutually encouraging relationships with other families.
Annual projects include a Siblings Camp, for those aged eight to 14, during the June school holidays, Siblings Connect, for siblings of those with autism, aged 16 to 28, and a year-end BBQ By The Bay, for the entire family. Other PSG-led initiatives include PSG family overseas vacation and family trips for the less privileged.",https://www.sgsocialsupport.com/resource/mSv2pvgBUFJ,No Content Found,Please contact the organisation for more details.,Please contact the organisation for more details.,Please contact the organisation for more details.,"St Andrew Autism Centre + − Leaflet | OneMap © contributors | Singapore Land Authority 1 Elliot Road 
S458686 6517 3800 enquiry@saac.org.sg Website",https://www.sgsocialsupport.com/resource/mSv2pvgBUFJ
Sarcoma Support Group (NCIS),"Officially launched in May 2016, the Sarcoma Support Group is established by the multi-disciplinary Sarcoma team at the NCIS in collaboration with the National Cancer Centre Singapore, KK Women’s and Children’s Hospital and the Singapore Sarcoma Consortium. It aims to reach out to Sarcoma patients, survivors and their caregivers.",https://www.sgsocialsupport.com/resource/Fxr59drdewf,No Content Found,Please contact the organisation for more details.,"Twice yearly support group meetings / activities Informal sharing sessions Quarterly educational talks ""NCIS Celebrates Life!"" survivorship party to celebrate the end of year festivities and look forward to a new year ahead",Please contact the organisation for more details.,Sarcoma Support Group Website Sarcoma Support Group ncis_survivorship@nuhs.edu.sg Website,https://www.sgsocialsupport.com/resource/Fxr59drdewf
SemiColons Support Group (SCS),"This support group aims to rehabilitate newly-treated colorectal cancer patients to enable them to adjust to a new quality of life. Members meet to share their personal experiences, exchange information, and gain insights into how their peers cope with their stomas and the common problems encountered.
Volunteer nurses and stoma therapists provide professional advice on how to attain independence and confidence in the care of their stomas. Talks and presentations on health-related subjects such as nutrition and exercise were also organised. Well-rehabilitated members are given the opportunity to give back by visiting new patients either before or after their operation to render psychological and emotional support.",https://www.sgsocialsupport.com/resource/7tgjXARvMbN,No Content Found,Open to colorectal cancer patients and survivors,Please contact the organisation for more details.,Please contact the organisation for more details.,SemiColons Support Group 6499 9132 supportgroup@singaporecancersociety.org.sg Website,https://www.sgsocialsupport.com/resource/7tgjXARvMbN
SG Lapbandits (KTPH - Bariatric Support Group),SG LapBandits is a support group jointly organised by the Weight Management Team and patients of Khoo Teck Puat Hospital (formerly Alexandra Hospital). This group aims to help individual who had undergone surgery or are considering the various form of Bariatric or weight loss surgery by facilitating peer support and by providing a platform for sharing and networking.,https://www.sgsocialsupport.com/resource/hkFwxs5AQm-,No Content Found,Please contact the organisation for more details.,Please contact the organisation for more details.,Please contact the organisation for more details.,SG Lapbandits (KTPH - Bariatric Support Group) ktph.wellness@alexandrahealth.com.sg Website,https://www.sgsocialsupport.com/resource/hkFwxs5AQm-
SG Quarantine Order Support Group,We help citizens with their Covid-19 quarantine journey and help them navigate through the doubts and uncertainties through the questions they have by providing answers and support. We also provide assistance through meals and groceries deliveries to citizens who are unable to acquire food during quarantine.,https://www.sgsocialsupport.com/resource/S2aj4-dd2D5,No Content Found,Please contact the organisation for more details.,Please contact the organisation for more details.,Please contact the organisation for more details.,SG Quarantine Order Support Group sgqovolunteers@gmail.com Website,https://www.sgsocialsupport.com/resource/S2aj4-dd2D5
SibsUnite,SibsUnite is a sibling support group founded by siblings to persons with special needs. We aim to support siblings through their different phases of life and drive the conversation around the complex challenges faced by siblings in Singapore.,https://www.sgsocialsupport.com/resource/CTKtAA53tPn,No Content Found,Please contact the organisation for more details.,Please contact the organisation for more details.,Please contact the organisation for more details.,SibsUnite sibsunite@gmail.com Website,https://www.sgsocialsupport.com/resource/CTKtAA53tPn
Sinar Harapan [Malay Support Group] (NCCS),"For Malay-speaking cancer patients and their caregivers, who may find it easier to speak or listen to someone in their mother tongue.",https://www.sgsocialsupport.com/resource/Txze8ZxZRft,No Content Found,Please contact the organisation for more details.,Please contact the organisation for more details.,Please contact the organisation for more details.,Sinar Harapan [Malay Support Group] (NCCS) Website,https://www.sgsocialsupport.com/resource/Txze8ZxZRft
Singapore Ankylosing Spondylitis Club,"The Singapore Ankylosing Spondylitis Club (SASC) is a support group for patients with Ankylosing Spondylitis. It was formed in 1990 under the umbrella of the National Arthritis Foundation.
Objectives of the club are:
1) To motivate patients to preserve their mobility through a regular exercise programme.
2) To promote awareness of Ankylosing Spondylitis among patients and their families.
3) To improve patient morale so that they can better cope with their disease.",https://www.sgsocialsupport.com/resource/P823aQyAqRY,No Content Found,Please contact the organisation for more details.,"Activities of the club : Our Club activities include regular talks by healthcare professionals on topics related to AS and to help patients cope with AS. At these sessions (usually done via webinars), participants also get to interact with the speakers through a Q&A session. There is also an AS Club chat group where members share useful information about their AS journey with one another in the chat. Other activities include social gatherings (like having meals at local favourite places) and outings to interesting places.",Please visit the website to fill up the registration form.,Audrey 6227 9726 audrey@naf.org.sg Website,https://www.sgsocialsupport.com/resource/P823aQyAqRY
"Singapore Caregivers: Epilepsy, Seizures, Global Developmental Delay (GDD)","As an extension from our whatapp chat group ""Epilepsy, Seizures, GDD"", anything related to these 3 areas will be discussed and shared. This group is Singapore based. We welcome anyone who can contribute to and benefit from this group even if you aren't in Singapore.",https://www.sgsocialsupport.com/resource/wvtaR823XKh,No Content Found,Please contact the organisation for more details.,Please contact the organisation for more details.,Please contact the organisation for more details.,"Singapore Caregivers: Epilepsy, Seizures, Global Developmental Delay (GDD) Website",https://www.sgsocialsupport.com/resource/wvtaR823XKh
Singapore Muslim Special Needs Support Group,"This open group is created to bring awareness with actions about special needs in Singapore and to give support to those with special needs.
It is especially created for the muslims as we would share Islamic practices, supplications and verses from the Quran. However, we would welcome those with other religions to join in as well.
Any questions or suggestions related to special needs are welcome.
We encouraged teachers and therapists to join as well. We encouraged parents with normal kids to join as well. Numbers of kids with special needs are growing and these kids will grow up with normal kids. Thus it is important for everyone to be able to integrate well with each other for a much better future. InsyaAllah.",https://www.sgsocialsupport.com/resource/Y7cB2Hrukzz,No Content Found,Please contact the organisation for more details.,Please contact the organisation for more details.,Please contact the organisation for more details.,Singapore Muslim Special Needs Support Group Website,https://www.sgsocialsupport.com/resource/Y7cB2Hrukzz
SMART Recovery (We Care Community Services),"SMART stands for Self-Management And Recovery Training.Founded in 1994, SMART Recovery is the leading self-empowering support group in addiction recovery. Participants learn psychological tools for recovery based on the latest scientific data drawn from outcome research on addiction treatments and observational studies of 'natural recovery' and participate in a worldwide community that includes free, self-empowering, science-based mutual help groups.It is a secular programme that helps people to recover from all types of addiction (substances or activities). SMART Recovery supports individuals who have chosen to abstain, or are considering abstinence from any type of addictive behaviours, by teaching how to change defeatist thinking, emotions, and actions; and to work towards long-term fulfilment and quality of life. This approach reinforces self-reliance and self-directed change.SMART Recovery is a recognised resource for substance abuse and addiction recovery by the American Academy of Family Physicians, the Center for Health Care Evaluation, The National Institute on Drug Abuse (NIDA), US Department of Health and Human Services, and the American Society of Addiction Medicine.Over 1700 weekly group meetings led by Registered SMART Recovery Facilitators are held worldwide. Each meeting is 90-minutes long and consists of checking-in, agenda-setting, group discussion, and checkout.&nbsp;WE CARE offers weekly SMART Recovery support group meetings for our registered members. Our meeting is also listed under the SMART recovery website, as well as the SMART International website. Our facilitators are Registered SMART Recovery Facilitators.&nbsp;",https://www.sgsocialsupport.com/resource/Vk7aAh6Dn5q,No Content Found,Interested participants are required to undergo an interview.,Please contact the organisation for more details.,Please contact the organisation for more details.,"We Care Community Services + − Leaflet | OneMap © contributors | Singapore Land Authority 11 Jalan Ubi, Block 5, #01-41 
S409074 3165 8017 help@wecare.org.sg Website",https://www.sgsocialsupport.com/resource/Vk7aAh6Dn5q
Spark,"The Society for the Promotion of Attention-Deficit Hyperactivity Disorder Research &amp; Knowledge (Spark) is an independent, voluntary and non-profit organisation set up in 2000.
Our story:
In 1998, the ADHD Parent Support Group was set up by a parent of an ADHD child as a means of gathering and providing support for other parents going through similar pains and frustrations. The success achieved by the Support Group in fostering understanding and acceptance towards ADHD children led to the realisation that more had to be done to raise awareness of ADHD amongst educators and the general public. In response to this, Spark was formed by a number of parents from the Support Group to expand on the scope of work done previously.
Our objectives:

To create public awareness of Attention-Deficit Hyperactivity Disorder (ADHD)
To help families with ADHD children cope better with the disorder
To promote understanding and research on ADHD

Our activities:

Monthly parent support group meetings for parents with ADHD children and interested parties
Publication of a regular newsletter to create awareness
Supporting and participating in research for ADHD
Collaborations with other organisations as and when invited to promote our cause
Learning activities and programmes for families with ADHD children, such as parenting workshops for parents with ADHD children",https://www.sgsocialsupport.com/resource/VpeMv9KdpPV,No Content Found,Please contact the organisation for more details.,Please contact the organisation for more details.,Please contact the organisation for more details.,"Spark + − Leaflet | OneMap © contributors | Singapore Land Authority 1008 Toa Payoh North, #03-08 
S318996 secretary@spark.org.sg Website",https://www.sgsocialsupport.com/resource/VpeMv9KdpPV
Special Needs Kids Singapore,"Support Group and Resource pool for parents with special needs children.
Please feel free to add other parents in this group as well as people who you know can help our kids. eg medical professionals, therapists, teachers etc.
Only requirement is that they have to be based in Singapore/familar in the Singapore system.
please note that upon request sent to join the group, you will have to answer the questions to state if you are a caregiver to a special needs child, or in a profession related. non replies will not be added into the group and requests will be declined",https://www.sgsocialsupport.com/resource/HHjfmzgnuvg,No Content Found,Please contact the organisation for more details.,Please contact the organisation for more details.,Please contact the organisation for more details.,Special Needs Kids Singapore Website,https://www.sgsocialsupport.com/resource/HHjfmzgnuvg
Specialised Case Management Programme (SPD),"SPD is a local charity set up to help people with disabilities of all ages to maximise their potential and integrate them into mainstream society.The Specialised Case Management Programme (SCMP) is a nation-wide pilot programme started in October 2006 to support persons of all age groups with disabilities and their caregivers, to empower them to lead more fulfilling and wholesome lives.",https://www.sgsocialsupport.com/resource/u4M-MAzL5B8,No Content Found,Persons with physical disabilities and functional issues Persons with multiple needs Singapore Citizens or Permanent Residents,"Through our social workers and case management officers, the programme provides the following services: Co-ordination of services within SPD and with other community resources Supportive counselling Support for purchase and assessment of assistive devices Support groups for learning and networking Caregivers’ support and training Information and referral on programmes and services The programme focuses on counselling and case management services to support persons with disabilities and their caregivers. Those who are referred tend to have multiple issues, for instance, lack of mobility independence and denial issues with their condition.","Submit the following documents to scmp@spd.org.sg SPD referral form Medical report or discharge summary Please retrieve the forms from https://www.spd.org.sg/specialised-case-management-programme/ Alternatively, mail it to: Specialised Case Management Programme 2 Peng Nguan Street SPD Ability Centre Singapore 168955 For enquiries, contact them using the form at https://spd.org.sg/useful-links/enquiry-form/","SPD Ability Centre + − Leaflet | OneMap © contributors | Singapore Land Authority 2 Peng Nguan Street, SPD Ability Centre 
S168955 6579 0749 scmp@spd.org.sg Website",https://www.sgsocialsupport.com/resource/u4M-MAzL5B8
Stroke Club (SNSA/SGH),"The Stroke Club was jointly set up by the Singapore National Stroke Association (SNSA) and the Singapore General Hospital. A stroke club is a place where stroke survivors and their caregivers can share their experiences with one another.
Stroke Befriending Service at SGH @ BVH
Stroke Support Groups (SSG)
The SSG is a network of stroke survivors, caregivers and volunteers.
The SSG is about:

Being a platform for both stroke survivors and caregivers to meet informally.
Participating in social activities together.
Offering emotional support to one another.
Sharing common challenges and knowledge about stroke.

There are two support networks: 
– Stroke support group (SSG) for stroke survivors 
– Caregiver support group (CSG) for caregivers 
Its goal is to grow and decentralise.
This will help to meet the needs of stroke survivors and caregivers across Singapore.",https://www.sgsocialsupport.com/resource/Jgq4H72p5Yg,No Content Found,Please contact the organisation for more details.,Please contact the organisation for more details.,Please contact the organisation for more details.,Stroke Club 8125 1446 contact@snsa.org.sg Website,https://www.sgsocialsupport.com/resource/Jgq4H72p5Yg
Stroke Self-Management Support Group (CGH),"The stroke self-management program aims to enhance the quality of life for stroke survivors by helping them build their confidence and ability to take charge of their own health. This is achieved through three ways:
Educating
Participants will learn about stroke, its symptoms, impact on both mind and body, and how to identify its risk factors.
Equipping
Participants are equipped with tools and practical advice on how to monitor their own physical health and manage their emotions. This includes blood pressure monitoring, coping skills, information on alternative therapies, community resources and nutrition.
Empowering
Armed with new knowledge and skills facilitated through group discussions and sharing, participants are empowered when they are able to take active steps to manage their own health. This helps them to gain a better understanding of stroke, and build their self-confidence in managing it, thus leading to a better quality of life.",https://www.sgsocialsupport.com/resource/yzaeSnAFXry,No Content Found,Please contact the organisation for more details.,Please contact the organisation for more details.,Please contact the organisation for more details.,Adrian Tan 6850 2897 Website Lee Yung Hsiang 6426 8619 Website,https://www.sgsocialsupport.com/resource/yzaeSnAFXry
Support for Eating Disorders Singapore (SEEDS) - SGH,"SEDS is a support group for survivors as well as supporters of those coping with an Eating Disorder. It is held on the first Thursday every month at LIFE centre at SGH, in collaboration with Singapore Association for Mental Health (SAMH) and it is free of charge. The aim of SEDS is to provide a platform for patients and caregivers to gain knowledge about Eating Disorders, share information, feelings and goals with others in a similar situation. The support group is facilitated by doctors, specialty care nurse, psychologists, family therapists, dietitians and other allied health care professionals who are trained on Eating Disorders, and most importantly by patients and caregivers.",https://www.sgsocialsupport.com/resource/pBh9Qddpn-k,No Content Found,Please contact the organisation for more details.,Please contact the organisation for more details.,Please contact the organisation for more details.,Support for Eating Disorders Singapore (SEEDS) 6321 4377 eatingdisorders@sgh.com.sg Website,https://www.sgsocialsupport.com/resource/pBh9Qddpn-k
The Silver Lining Support Group,"Join us every Tuesday night 8:00pm-9:30pm for an interactive support group session. We provide a safe and non-judgemental environment where gamblers and their family members can interact with one another. This 10-session course will empower our members and their families through different areas such as techniques to overcome their gambling urges, financial budgeting, debt management and how to manage loan shark harassments. Also hear from reformed problem gamblers as they share their life experiences and success stories in walking out of their old paths to finally quitting their addictions altogether. Family members are strongly encouraged to join us too. The success rate is much higher if the whole family goes through the 10 sessions",https://www.sgsocialsupport.com/resource/aTmkM9TcpPs,No Content Found,Please contact the organisation for more details.,Please contact the organisation for more details.,Please contact the organisation for more details.,"The Silver Lining + − Leaflet | OneMap © contributors | Singapore Land Authority 22 New Industrial Road, #07-03/04, Primax Building 
S536208 6749 0400 admin@silverlining.com.sg Website",https://www.sgsocialsupport.com/resource/aTmkM9TcpPs
TOUCH Silent Club (TSC),"TOUCH Silent Club (TSC) provides a community of friendship and support to Deaf persons of all ages. Besides academic coaching for students, we’ve exciting social activities and leadership development programmes for youths.
We actively work with employers to match suitable jobs for our Deaf Members, organise support groups for parents of Deaf children and provide Deaf seniors with enriching programmes.",https://www.sgsocialsupport.com/resource/ncZrVfLYzma,No Content Found,Please contact the organisation for more details.,Please contact the organisation for more details.,Please contact the organisation for more details.,"TOUCH Silent Club (TSC) + − Leaflet | OneMap © contributors | Singapore Land Authority Blk 162 Bukit Merah Central #05-3555 
S150162 6251 4633 silent.club@touch.org.sg Website",https://www.sgsocialsupport.com/resource/ncZrVfLYzma
Trans and Non-Binary Support Group ( TransNB Friends ),"TransNB Friends is a transgender and non-binary support group, a safe and supportive space for anyone who identifies as transgender, non-binary, or is questioning their gender identity.Whether you are just starting to explore your gender identity, are in the process of transitioning, or have already transitioned, we welcome you with open arms. Our group is inclusive of all races, ethnicities, and ages, and we value diversity and respect for all. We aim to create a welcoming and supportive environment where everyone can be themselves and share their experiences without judgment.This project is organised under Transbefrienders in Singapore, a peer support service for transgender youths primarily focused on befriending.",https://www.sgsocialsupport.com/resource/ADYvr6syaaL,No Content Found,"Anyone who identifies as transgender, non-binary, or is questioning their gender identity can apply.","TransNB Friends is a community of individuals who share similar experiences, and aim to provide emotional support and advice through online video calls. Sessions take place twice a month.",Please apply at https://www.transbefrienders.com/groupsupport,TransNB Friends transnbfriends@transbefrienders.com Website,https://www.sgsocialsupport.com/resource/ADYvr6syaaL
Typeone.sg,"typeOne.sg is a group for people with Type 1 Diabetes in Singapore. Anyone with Type 1 Diabetes, or is family with someone who has Type 1 Diabetes is welcome to join. This group is a place where people with Type 1 Diabetes can chat, share tips or ask questions about living with Diabetes. Anything posted on the page is only viewed by other members of the group. This group can not be used to ask for medical advice and any posts that do ask for this will be deleted and directed to a healthcare professional. This group's adminstrators are Angela, Candy, Cheng Yong, Karise, Marco, and Zuanyan. The admins either have Type 1 Diabetes themselves or are parents of children with Type 1 Diabetes, but are not healthcare professionals",https://www.sgsocialsupport.com/resource/7XRrAa6KD4K,No Content Found,Please contact the organisation for more details.,Please contact the organisation for more details.,Please contact the organisation for more details.,Typeone.sg Website,https://www.sgsocialsupport.com/resource/7XRrAa6KD4K
