Name,Description,Link,Full Content,Who can apply,What to expect,How to apply,Contact,Source URL
Caregiver Support Group (Caregiving Welfare Association),"The Caregiving Welfare Association (CWA) was established with the mission to improve the quality of life of elderly through dependable direct services, and to inculcate a generation of responsible and knowledgeable caregivers in an ageing population. Its services broadly fall under these three areas - Elderly Wellness &amp; Social Support, Welfare Support and Education &amp; Awareness.  
As part of the Caregiving Welfare Association (CWA) efforts to reach out to family caregivers, we encourage family caregivers to join us at our monthly caregiver support group sessions. 
Very often, caregivers are unaware of where to seek assistance from, many individuals end up bearing the heavy burden of looking after their loved ones themselves and suffering in silence. This affects them emotionally, physically and mentally – resulting in caregiver burnout at the end of the day.
We believe that there are many benefits which caregivers could gain from by participating in such group work. For example, individual gains mutual support from one another, and through the sharing of personal experiences, one could learn how to manage or even overcome such struggles eventually.
CWA currently runs three caregiver support groups for family caregivers to connect with one another – two English support groups (Art therapy and Mindfulness) and one Mandarin pilot support group. The English Art therapy support group session is conducted by our Art Therapist, Ms Jeanette Chan, and it will be held once a month on a Saturday morning from 9.30am to 11.30am. As for the English Mindfulness-based support group session, it will be conducted by Ms Erin Lee (Mindfulness Coach) once a month on a weekday from 2.30pm to 4.00pm. For the Mandarin pilot support group, this is catered for Mandarin-speaking caregivers. Currently, this session is conducted by an Art Therapist, Ms Ng Jue Ann, and runs once a month on a weekday afternoon from 2.30pm to 4.00pm. All three support group sessions are held at our CWA HQ located at Blk 3 Ghim Moh Road.",https://www.sgsocialsupport.com/resource/V2n5mCvETTB,No Content Found,Please contact the organisation for more details.,Please contact the organisation for more details.,Please contact the organisation for more details.,Caregiving Welfare Association 6466 7957 contact@cwa.org.sg Website,https://www.sgsocialsupport.com/resource/V2n5mCvETTB
Caregiver Support Group (Dementia Singapore),"Caregiver Support Group provides an opportunity for respite while meeting other caregivers in a similar situation to share caregiving experiences and practical tips, learn about dementia, and discover resources in a relaxed and safe environment.
Sessions are conducted in English, Mandarin and Malay for two hours, consisting of a talk by guest speakers and sharing session amongst caregivers.",https://www.sgsocialsupport.com/resource/M2cLryD7bAf,No Content Found,Please contact the organisation for more details.,Please contact the organisation for more details.,Please contact the organisation for more details.,"CSS + − Leaflet | OneMap © contributors | Singapore Land Authority Caregiver Support Services
20 Bendemeer Road, #01-02, BS Bendemeer Centre, Singapore 339914 
S339914 Mon - Fri: 9 am–6 pm
Sat - Sun: Closed 6377 0700 registration@dementia.org.sg DSC + − Leaflet | OneMap © contributors | Singapore Land Authority Dementia Social Club
298 Tiong Bahru Road, #10-05, Central Plaza, Singapore 168730 
S168730 Mon - Fri: 8:30 am–5:30 pm
Sat - Sun: Closed registration@dementia.org.sg Helpline Monday–Friday, 9am–6pm
Saturday, 9am–1pm 6377 0700 Website JP + − Leaflet | OneMap © contributors | Singapore Land Authority New Horizon Centre (Jurong Point)
1 Jurong West Central 2, #04-04, Jurong Point Shopping Centre 
S648886 Mon - Fri: 7:30 am–6:30 pm
Sat - Sun: Closed registration@dementia.org.sg",https://www.sgsocialsupport.com/resource/M2cLryD7bAf
Caregiver Support Group (Down Syndrome Association Singapore),"Caregiver Support Group aims to provide a holistic peer support ecosystem in DSA for caregivers of children with special needs. The group offers a safe environment for you to share your caregiving journey and enhance your access to knowledge, skills, resources and support within the community. Such interaction can provide emotional support, social support, and informational support which allow better stress management and reduce the sense of isolation.",https://www.sgsocialsupport.com/resource/bu38chMh3pN,No Content Found,Please contact the organisation for more details.,Please contact the organisation for more details.,Please contact the organisation for more details.,"Down Syndrome Association Singapore + − Leaflet | OneMap © contributors | Singapore Land Authority 9 Bishan Place, Junction 8 (Office Tower) #09-01 
S579837 Monday to Saturday, 8.30am to 6.00pm. We are closed on Sundays and Public Holidays 6500 9321 admin@downsyndrome-singapore.org Website",https://www.sgsocialsupport.com/resource/bu38chMh3pN
Caregivers Support Group (Club HEAL),"The caregiver plays an integral role in forming a strong support system for any individual suffering from a mental illness. With the expertise of qualified members, Club HEAL carries out Caregiver Support Groups thrice a month to provide the necessary assistance that should be rendered to caregivers.",https://www.sgsocialsupport.com/resource/DQRT8Dw-TER,No Content Found,Please contact the organisation for more details.,Please contact the organisation for more details.,Please contact the organisation for more details.,"Club HEAL @ BBE (West) + − Leaflet | OneMap © contributors | Singapore Land Authority 244 Bukit Batok East Ave 5 #01-02 Singapore 650244 
S650244 2nd Friday of the month, 8pm – 10pm Website Club HEAL @ Marsiling (North) + − Leaflet | OneMap © contributors | Singapore Land Authority Blk 317 Woodlands St 31 #01-194 Singapore 730317 
S730317 3rd Friday of the month, 8pm – 10pm Website Club HEAL @ Pasir Ris East (East) + − Leaflet | OneMap © contributors | Singapore Land Authority Blk 148 Pasir Ris St 13 #01-24 Singapore 510148 
S510148 1st Friday of the month, 8pm – 10pm info@clubheal.org.sg Website",https://www.sgsocialsupport.com/resource/DQRT8Dw-TER
Caregivers Support Group (GoodLife!),"Caregiver Support Groups (CSGs) offer a private and safe environment for caregivers to share their thoughts, challenges and learnings with one another as they go through similar experiences. Such insights allow caregivers to share their knowledge through practical caregiving and self-care tips.
CSGs also help caregivers understand that they are not alone in their caregiving journey allowing the group to emotionally support each other.
The centre also reaches out to seniors living alone to ensure they are provided with necessary assistance and support to age-in-place.
These programmes also include:

Community Resource, Engagement and Support Team (CREST)
CREST serves as a community network for people with dementia and depression, as well as caregivers who need the additional support to care for their loved ones. CREST links the community and residents with the appropriate mental health care and social support networks through outreach and education.
Casework &amp; Counselling Services
A dedicated team of social workers assess the needs of the elderly and link senior citizens or caregivers to the relevant community resources.
Home Personal Care (HPC)
Our home-based personal care services supporting seniors and their caregivers include:


Activities of Daily Living (for e.g., bathing, dressing, feeding)
Instrumental Activities of Daily Living (for e.g., light housekeeping, laundry)
Medication Assistance
Mind Stimulating Activities
Simple Maintenance Exercises
Elder Sitting and Respite


Befriending
A committed team of trained senior volunteers work closely with our staff to conduct regular home visits to other seniors in the community and their caregivers who need assistance and support.",https://www.sgsocialsupport.com/resource/GfUyaCq36Wc,No Content Found,Please contact the organisation for more details.,Please contact the organisation for more details.,Please contact the organisation for more details.,"GoodLife! Marine Parade Active Ageing Centre + − Leaflet | OneMap © contributors | Singapore Land Authority 15 Marine Terrace #01-18  Singapore 440015 
S440015 Monday – Friday 9.00am – 6.00pm
Closed on Saturday, Sunday & Public Holidays 6445 0570 contact@goodlife.org.sg Website",https://www.sgsocialsupport.com/resource/GfUyaCq36Wc
Caring Hearts Support Group (NUHCS),"Who We AreCaring Hearts Support Group (CHSG) is a voluntary initiative by patients of National University Heart Centre, Singapore (NUHCS). The support group is established with the aim to support one another in our journey to remain heart healthy.&nbsp;Our Vision and MissionTo build an inspiring and caring heart patient support group that brings positive changes to the lives of heart patients and our community.What We DoThe H.E.L.P Progamme Initiatives is designed and supported by CHSG. Through passion and care, and with the continued educational and training support from NUHCS, we aim to instill friendship and bonding amongst heart patients to foster a heart healthy lifestyle through these initiatives.&nbsp;H - Healing Towards a Healthy Heart (We work together towards attaining and sustaining a healthy heart).E - Empower, Educate and Exercise (Through this partnership, we empower each other through education and exercise to achieve our objectives).L - Balanced Lifestyle and Love (We promote a balanced and healthy lifestyle filled with meaning, love and laughter through friendship and social activities).P - Perseverance, Progress and Prevent (We work towards supporting each other to persevere and overcome challenges in our heath progress in preventing heart attacks, blocked arteries, chronic diseases, and other heart related issues).&nbsp;",https://www.sgsocialsupport.com/resource/W95m6c9fRGk,No Content Found,Please contact the organisation for more details.,We organise: Monthly Walks Educational Talks Exercise Sessions Sharing/Networking Sessions Social Get Together Community Engagement and Events,Please contact the organisation for more details.,Magdalene Chia (Caring Hearts Support Group) mchia@kucinta.com Website,https://www.sgsocialsupport.com/resource/W95m6c9fRGk
CASPER PSG,"CASPER PSG - Care And Share Parents Ever Resilient
A parent support group for parents by parents of children with developmental needs - one that cares for and shares with one another",https://www.sgsocialsupport.com/resource/y4nxHeVjWZV,No Content Found,Please contact the organisation for more details.,Please contact the organisation for more details.,Please contact the organisation for more details.,CASPER PSG Website,https://www.sgsocialsupport.com/resource/y4nxHeVjWZV
Child Bereavement Support,"Child Bereavement Support (Singapore) is an informal network of bereaved parents who have all found that meeting other bereaved parents is what has made the biggest difference to us, and given us the most support, the most hope and the most comfort. People grieve in very different ways but we have all learned through our own experience that parent to parent support is just invaluable.
Our Objectives
CBSS was set up by bereaved parents for bereaved parents with very simple objectives: we provide support and friendship through a 'befriending' network, hold monthly support meetings, and maintain this website of resource and information to help bereaved parents find their way through their loss.  Where possible, we conduct CBSS talks on how to support bereaved families to doctors, nurses and medical students to promote compassion and understanding for families when death occurs on their watch.  
Our Reach
Being an independent, multi-cultural and multi-religious, parent-to-parent grouping, non-affiliated to any hospital or organisation, we are able to reach out to all bereaved parents in Singapore (of any race, religion or culture) who have suffered the loss of a baby or child - during pregnancy, in early infancy, at any stage of childhood, and even later into adulthood - and no matter in what circumstances or how recently or how long ago. We are open to any parent who needs support in their time of bereavement.",https://www.sgsocialsupport.com/resource/amNHG96xh38,No Content Found,Please contact the organisation for more details.,Please contact the organisation for more details.,They can be contacted through form at https://www.cbss.sg/contact-us,Child Bereavement Support help@cbss.sg Website,https://www.sgsocialsupport.com/resource/amNHG96xh38
Children's Diabetes Support Group (KKH),"Your child was diagnosed with diabetes and your world has been turned upside down. Where do you go from here? How do you handle the responsibility? How do you help your child live life to the fullest?
Diabetes often redefines the lives of the children and their families, impacting every aspect of their lives. New roles and responsibilities are placed on the family and changes made to cope with the condition.
The support group provides children with diabetes and their families a platform for mutual support and interaction. It offers families the opportunity to meet and share their experiences with each other.
Members of the support group meet every three to four months – usually during the school holidays – for informal get-togethers and continuing education, conducted by the Diabetes Multi-disciplinary Team.
This support group is headed by Diabetes Nurse Joyce Lim and strongly supported by the team.",https://www.sgsocialsupport.com/resource/MeMHYdJndrH,No Content Found,Please contact the organisation for more details.,Please contact the organisation for more details.,Please contact the organisation for more details.,"Children's Diabetes Support Group (KKH) 6394 3771 Website Joyce Lim Monday to Friday, 8.30am to 5.00pm & Saturday, 8.30am to 12.00pm 6394 2094 Website",https://www.sgsocialsupport.com/resource/MeMHYdJndrH
Children's Kidney Patient Support Group (NUH),"The emotional well-being of our patients with long-term kidney disease is important to us. Hence, we have set up a support group for these patients and their families, with the aims of enhancing their psychosocial adjustment and helping them to lead fulfilling lives despite their physical challenges.
Together with child life therapists, art therapists and psychologists, we help our young patients and their families understand and cope with their emotions and anxiety. The Annual Children's Kidney Camp, started in 2000, is always a highlight among our patients, who include dialysis and transplant patients. Throughout the years, our patients have camped at various locations including Outward Bound School at Pulau Ubin, Sarimbun Scouts' camp and Sentosa and have even gone on a cruise. These camps fostered strong friendship among our patients, created lifetime experiences for them and taught them resilience in a fun way.
This support group also organises regular workshops for patients and their families.",https://www.sgsocialsupport.com/resource/pumSTBeLwcj,No Content Found,Please contact the organisation for more details.,Please contact the organisation for more details.,Please contact the organisation for more details.,Cheng Peizhi 6772 2447 Peizhi_CHENG@nuhs.edu.sg Website,https://www.sgsocialsupport.com/resource/pumSTBeLwcj
Cleft Lip and Palate Association of Singapore (SGH),"The Cleft Lip and Palate Association of Singapore (CLAPAS) was formed with the assistance of cleft palate organisations in the United Kingdom and Australia and registered with the Registrar of Societies in Singapore in 1987.  A detailed schedule of events is available from Ward 63 (Plastic Surgery). The volunteer nurses are also involved with the FSG social activities, and provide secretarial support.",https://www.sgsocialsupport.com/resource/XRWqV7nS4ty,No Content Found,Please contact the organisation for more details.,Please contact the organisation for more details.,Please contact the organisation for more details.,Cleft Lip and Palate Association of Singapore (SGH) 6321 4631 Website,https://www.sgsocialsupport.com/resource/XRWqV7nS4ty
Colon Cancer Support Group (TTSH),"The Colon Cancer Support Group (CCSG) at Tan Tock Seng Hospital was founded in 2004 with the support of TTSH Department of General Surgery, Colorectal sub-specialty.
All colon cancer patients and their caregivers are strongly encouraged to join the support group!",https://www.sgsocialsupport.com/resource/MMXpaDtWebn,No Content Found,Please contact the organisation for more details.,Please contact the organisation for more details.,Please contact the organisation for more details.,Colon Cancer Support Group (TTSH) Website,https://www.sgsocialsupport.com/resource/MMXpaDtWebn
Combined Genetic Support Group (NCCS),"Support group for Support group for patients with genetic syndromes such as Li-Fraumeni Syndrome (LFS), Neurofibromatosis (NF), Lynch Syndrome, Familial Adenomatous Polyposis (FAP), and Hereditary Breast and Ovarian Cancer associated gene (BRCA), etc.",https://www.sgsocialsupport.com/resource/62BScnhFCR3,No Content Found,"Patients with genetic syndromes such as Li-Fraumeni Syndrome (LFS), Neurofibromatosis (NF), Lynch Syndrome, Familial Adenomatous Polyposis (FAP), and Hereditary Breast and Ovarian Cancer associated gene (BRCA), etc.",Please contact the organisation for more details.,Form,Combined Genetic Support Group (NCCS) Website,https://www.sgsocialsupport.com/resource/62BScnhFCR3
Craniofacial Support Group (KKH - for children),"Managed by craniofacial affected families, volunteers and coordinators, the support group provides mutual support, interaction and friendship building. It aims to share experiences so that craniofacial affected children can grow up happy and confident.
The support group is made up of smaller groups, including:
Cleft Lip and Palate Group
Craniosynostosis Group
Aperts Group
Hemifacial Microsomia (HFM) Group
Haemangioma Group
The cleft and craniofacial team also conducts continuing education to enforce awareness and knowledge of the condition.",https://www.sgsocialsupport.com/resource/q-FWjpsp6Eb,No Content Found,Please contact the organisation for more details.,Please contact the organisation for more details.,Please contact the organisation for more details.,Craniofacial Support Group (KKH - for children) josephine.tan.ch@kkh.com.sg Website,https://www.sgsocialsupport.com/resource/q-FWjpsp6Eb
Crohn's & Colitis Society of Singapore,"We are a group of dedicated volunteers who have come together to create a support system for patients diagnosed with Crohn’s Disease or Ulcerative Colitis. Our Organization is a registered charity under the Ministry of Health.
We have been working in close collaboration with Gastroenterologists, Nurses, Dieticians, Pharmacists, Medical Social Workers and other stakeholders to support an IBD patient’s needs. While physical health gets a lot of attention, we need to carefully look into the emotional impact of such chronic illnesses.
Our members thoroughly enjoy our regular Support Group Meetings where not only IBD patients but their family members are also welcome. Living with an illness like IBD impacts not only the patient but also affects other family members physically, financially and emotionally. By providing a platform for patients to share, our charity brings members closer to each other.",https://www.sgsocialsupport.com/resource/fauq6uNGwxP,No Content Found,Please contact the organisation for more details.,Please contact the organisation for more details.,Please contact the organisation for more details.,"Crohn's & Colitis Society of Singapore + − Leaflet | OneMap © contributors | Singapore Land Authority Level 42, Suntec Tower 3, 8 Temasek Boulevard 
S038988 6829 2255 info@ibd.org.sg Website",https://www.sgsocialsupport.com/resource/fauq6uNGwxP
DAS Parent Support Group (Dyslexia),"The DAS Parent Support Group (PSG) was formed to provide support for parents of the students at DAS. It aims to organise inspirational sharing sessions with successful dyslexics, fun-filled activities just for DAS Students, their parents and even for the whole family. Be part of the PSG.
PSG organised meetings/events are made known through our PSG Facebook and emails to parents.
The PSG Facebook group is a private group for DAS Parents and access is by invitation only.
If you would like to join the DAS PSG, please email to psg@das.org.sg",https://www.sgsocialsupport.com/resource/w8xmz6eptA7,No Content Found,Please contact the organisation for more details.,Please contact the organisation for more details.,Please contact the organisation for more details.,"Dyslexia Association of Singapore Limited + − Leaflet | OneMap © contributors | Singapore Land Authority 1 Jurong West Central 2
#05-01, Jurong Point 
S648886 6444 5700 psg@das.org.sg Website",https://www.sgsocialsupport.com/resource/w8xmz6eptA7
DEBRA Singapore,"Dystrophic Epidermolysis Bullosa Research Association, Singapore (DEBRA Singapore), is a support group for patients living with congenital epidermolysis bullosa, a rare skin condition that in its most severe forms affects all of the body's linings, the skin, the linings of the mouth and oesophagus, and even the eyes.
​
Our goals are to : 

Increase awareness of Epidermolysis Bullosa (EB)
Provide resources, support and funding for EB patients and their families
Create and strengthen networks for professionals involved with EB care or research, in Singapore and around the world
Be a regional centre of research excellence, and medical and diagnostic support
Foster the development of new Debra groups and mentor newly established ones.",https://www.sgsocialsupport.com/resource/w6cgcRQcyGu,No Content Found,Please contact the organisation for more details.,Please contact the organisation for more details.,Please contact the organisation for more details.,"DEBRA Singapore + − Leaflet | OneMap © contributors | Singapore Land Authority 100 Bukit Timah Road
KK Women's and Children's Hospital
 
S229899 debrasingapore@gmail.com Website",https://www.sgsocialsupport.com/resource/w6cgcRQcyGu
Dementia Support Group (SGH),Dementia support group provides a platform for sharing of personal experiences and social meetings for you and your caregivers for the journey of living with dementia.,https://www.sgsocialsupport.com/resource/KUDA85ykUeB,No Content Found,Please contact the organisation for more details.,Please contact the organisation for more details.,Please contact the organisation for more details.,"Dementia Support Group (SGH) SINGAPORE GENERAL HOSPITAL
Outram Road
Singapore 169608 6222 3322 Website",https://www.sgsocialsupport.com/resource/KUDA85ykUeB
Diabetes Singapore Support Group,"Our Diabetes Singapore Support Group serves as a platform for people with diabetes and their family members to:

Share their experiences in dealing with diabetes
Learn about the latest updates in diabetes management
Interact and learn from one another
Enjoy activities together such as cycling and painting on a regular basis
Meet like-minded people and more…",https://www.sgsocialsupport.com/resource/PQ933pr8FcM,No Content Found,Please contact the organisation for more details.,Please contact the organisation for more details.,Please contact the organisation for more details.,Diabetes Singapore enquiry@diabetes.org.sg Website,https://www.sgsocialsupport.com/resource/PQ933pr8FcM
Empowering grief support group (Viriya Community Services),Are you looking for a group to share your grieving journey or to seek social support with others who are grieving too? &nbsp;Join us at our monthly support group led by our grief counsellor.,https://www.sgsocialsupport.com/resource/SNJ-4fAUW4Z,No Content Found,Please contact the organisation for more details.,Please contact the organisation for more details.,Register with us https://tinyurl.com/EG2024 .,"Empowering grief support group (Viriya Community Services) + − Leaflet | OneMap © contributors | Singapore Land Authority 142 Potong Pasir Avenue 3
#01-224 
S350142 6285 8033 contact@viriya.org.sg Website",https://www.sgsocialsupport.com/resource/SNJ-4fAUW4Z
Epilepsy Support Group (SGH),The support group collaborates and works closely the Singapore Epilepsy Foundation. For more information on various support group activities: please log onto: http://www.epilepsy.com.sg,https://www.sgsocialsupport.com/resource/Ltqgw7REzEq,No Content Found,Please contact the organisation for more details.,Please contact the organisation for more details.,Please contact the organisation for more details.,Epilepsy Support Group Website,https://www.sgsocialsupport.com/resource/Ltqgw7REzEq
