Name,Description,Link,Full Content,Who can apply,What to expect,How to apply,Contact,Source URL
Acute Leukaemia Warriors Support Group (NCIS),"Established in 2015, the Acute Leukaemia Warriors Support Group is organised by a multi-disciplinary team at the NCIS. It comprises of young adult patients and survivors who have been afflicted by Acute Leukaemia. Caregivers are also welcome to join.
Our Mission
Being diagnosed with Acute Leukaemia may be difficult to accept for anyone, particularly so for young adults who are at the prime of their life – excelling at their studies, climbing the corporate ladder or developing relationships. Not only do they have to battle their diagnosis and treatment, they also have to manage their emotions and physical changes, as well as cope with changes to their lifestyle.
The Acute Leukaemia Warriors Support Group hopes to encourage young adults to overcome their battle with the disease and triumph as confident individuals with a strong passion for life and a heart to support fellow young adult Acute Leukaemia patients, so that the battle can be won together.",https://www.sgsocialsupport.com/resource/99WQDsWUVEd,No Content Found,Please contact the organisation for more details.,Patient sharing sessions in both large and small groups Visitations by fellow patients Big group gatherings to share and have a time of food and fun Pairing of patients with similar situations for in-depth and continued support,Please contact the organisation for more details.,Acute Leukaemia Warriors Support Group (NCIS) ncis_survivorship@nuhs.edu.sg Website,https://www.sgsocialsupport.com/resource/99WQDsWUVEd
ADHD/ASD Warriors Singapore,"A platform for parents of kids with ADHD, ASD, ODD and related needs to share information and resources. A community for strengthening and restoring dignity, self-confidence in our children. This group is set up especially to help fellow mothers who may or may not have the means to seek professional help all the time. Knowing how expensive it is to live in Singapore with a child with special needs. We are here to support each other and create a more positive environment because mothers struggling together, grow together.",https://www.sgsocialsupport.com/resource/4-L8yLutDqn,No Content Found,Please contact the organisation for more details.,Please contact the organisation for more details.,Please contact the organisation for more details.,ADHD/ASD Warriors Singapore Website,https://www.sgsocialsupport.com/resource/4-L8yLutDqn
Adolescents and Young Adults Oncology (AYAO) Support Group (NCCS),This group brings together young patients who share similar experiences and provides opportunities for them to connect with one another.,https://www.sgsocialsupport.com/resource/eNdDbPBMQpX,No Content Found,Young patients 45 years of age and below.,Please contact the organisation for more details.,Please contact the organisation for more details.,Adolescents and Young Adults Oncology (AYAO) Support Group (NCCS) Website,https://www.sgsocialsupport.com/resource/eNdDbPBMQpX
Al-Anon Family Groups,"Al‑Anon is a mutual support program for people whose lives have been affected by someone else’s drinking. 
By sharing their experience, strength, and hope, and applying the principles of Al-Anon, families and friends of alcoholics can bring positive changes to their own lives. 
Participation in Al-Anon does not require the alcoholic to admit the existence of a drinking problem or to be seeking help themselves.",https://www.sgsocialsupport.com/resource/fwF-JSN2zcu,No Content Found,Please contact the organisation for more details.,Please contact the organisation for more details.,Please contact the organisation for more details.,Al-Anon Family Groups 9774 2539 info@alanonsingapore.org Website,https://www.sgsocialsupport.com/resource/fwF-JSN2zcu
Alcoholics Anonymous (AA),"Alcoholics Anonymous is a fellowship of men and women who share their experience, strength and hope with each other that they may solve their common problem and help others to recover from alcoholism. The only requirement for membership is a desire to stop drinking. There are no dues or fees for A.A. membership; we are self-supporting through our own contributions. A.A. is not allied with any sect, denomination, politics, organization or institution; does not wish to engage in any controversy; neither endorses nor opposes any causes. Our primary purpose is to stay sober and help other alcoholics to achieve sobriety.",https://www.sgsocialsupport.com/resource/RyF37cprPHN,No Content Found,Please contact the organisation for more details.,Please contact the organisation for more details.,Please contact the organisation for more details.,Alcoholics Anonymous (AA) 8112 8089 help@singaporeaa.org Website,https://www.sgsocialsupport.com/resource/RyF37cprPHN
Amputee Support Group (TTSH/THK),"This is the Amputee Support Group (ASG) run by Ang Mo Kio-Thye Hua Kwan Hospital and Tan Tock Seng Hospital Rehabilitation Centre.
In this group, we support each other as amputees and organise activities and outings on a monthly basis on the last friday or saturday of the month (usually starting from 10am to 1pm)
Objectives of the ASG:
1) To provide a platform for the persons with amputations (PWAs) to share issues and challenges faced in life after amputation.
2) To allow professionals to effectively share knowledge and information useful for management of condition.
3) To establish and maintain a social support network for the PWAs in order to address their psycho-social needs and minimise the risk of social isolation.",https://www.sgsocialsupport.com/resource/hptzPfcVW5q,No Content Found,Please contact the organisation for more details.,Please contact the organisation for more details.,Please contact the organisation for more details.,Amputee Support Group (TTSH/THK) Website,https://www.sgsocialsupport.com/resource/hptzPfcVW5q
"ASD, ADHD and ADD Supports Group Singapore",This group is created to support all the parents with ASD or ADHD or ADD kids in Singapore. This will be a platform for sharing any informations or support in order to help parents and the kids to have easier and happier life.,https://www.sgsocialsupport.com/resource/58-4LJsFSdz,No Content Found,Please contact the organisation for more details.,Please contact the organisation for more details.,Please contact the organisation for more details.,"ASD, ADHD and ADD Supports Group Singapore Website",https://www.sgsocialsupport.com/resource/58-4LJsFSdz
Asthma Club (KKH - for children),"For asthmatic children and their parents, the club helps them learn about:
Bronchial asthma
How to manage the condition
How they can lead a normal and active life
The club organises activities every three months, usually during the school holidays.
Some of the programmes include educational seminars for parents and older children, and indoor and outdoor activities supervised by our medical professionals.",https://www.sgsocialsupport.com/resource/RVW3u8Vmt6U,No Content Found,Please contact the organisation for more details.,Please contact the organisation for more details.,Please contact the organisation for more details.,Asthma Club (KKH - for children) 6394 3016 Website,https://www.sgsocialsupport.com/resource/RVW3u8Vmt6U
Autoimmune Diseases Singapore,"Autoimmune Diseases Singapore shares information about autoimmune diseases relevant to Singapore and the Asian region. Our sharing are only for informational purposes and should not be construed as medical advice. Please always consult your doctor for medical advice.
We run an informal support group for Singaporeans and those living in Singapore diagnosed with autoimmune diseases. The group was first set up in Meetup in 2013, and a closed Facebook group was set up in 2015 to facilitate online sharing of our knowledge and experiences living with autoimmune diseases.",https://www.sgsocialsupport.com/resource/4fBrQq5snKd,No Content Found,Please contact the organisation for more details.,Please contact the organisation for more details.,Please contact the organisation for more details.,Autoimmune Diseases Singapore autoimmunediseasessg@gmail.com Website,https://www.sgsocialsupport.com/resource/4fBrQq5snKd
Bariatric Surgery Support Group (SGH),"Having problems with your weight? Tried dieting &amp; exercises and they do not work? Together with healthy eating, lifestyle changes and bariatric surgery, they can IMPROVE your problems. It is also an ADDITIONAL TREATMENT for metabolic diseases related to obesity. Want to know more about bariatric surgery? JOIN US at our support group sessions!",https://www.sgsocialsupport.com/resource/JQ6kcCUVtWh,No Content Found,Please contact the organisation for more details.,Please contact the organisation for more details.,Please contact the organisation for more details.,Bariatric Surgery Support Group (SGH) 6222 3322 sgh.lifeobesity@sgh.com.sg Website,https://www.sgsocialsupport.com/resource/JQ6kcCUVtWh
Bishana Ladies Group (SCS),"Bishana was formed specifically for female survivors as well as women who have been diagnosed with any type of cancer and are receiving treatment. Members meet monthly for a variety of programmes which include educational talks/ workshops, social and recreational activities, outings, and enrichment programmes.
This support group provides a platform for these women to share their experiences and to exchange information with one another. Newly diagnosed patients are encouraged to attend and interact with other survivors in the group to learn how to cope with changes in their lifestyles as well as to receive psychological and emotional support.",https://www.sgsocialsupport.com/resource/PkRadMc9VNY,No Content Found,Open to all female cancer patients and survivors,Please contact the organisation for more details.,Please contact the organisation for more details.,Bishana Ladies Group 1800 727 3333 supportgroup@singaporecancersociety.org.sg Website,https://www.sgsocialsupport.com/resource/PkRadMc9VNY
Bone Marrow Transplant Support Group (SGH),"The group was first initiated by a few nurses assisting in the Post-BMT clinic at the Haematology Centre. There was a high level of stress, fear, anxiety, anger and depression noted in post-BMT patients, especially during the first three months following therapy. The need to come back for repeated therapy also often disrupted the patient's personal life and functional abilities.",https://www.sgsocialsupport.com/resource/8Xxb8xZsFHt,No Content Found,Please contact the organisation for more details.,Please contact the organisation for more details.,Please contact the organisation for more details.,Bone Marrow Transplant Support Group (SGH) 6321 4722 Website,https://www.sgsocialsupport.com/resource/8Xxb8xZsFHt
Brain Tumour Society,"We are a community of brain tumour patients, caregivers and friends who come together from all walks of life and many different circumstances to support and help each other in our journeys so that no one with a brain tumour would walk alone.
Established in March 2014, BTSS was accorded Institution of Public Character(IPC) status by the Ministry of Health on 8 June 2022.",https://www.sgsocialsupport.com/resource/YjZSXWqQzuN,No Content Found,Please contact the organisation for more details.,Please contact the organisation for more details.,Please contact the organisation for more details.,Brain Tumour Society enquiry@braintumoursociety.org.sg Website,https://www.sgsocialsupport.com/resource/YjZSXWqQzuN
Brain Tumour Society Singapore Support Group,"We know that those who have been affected by a brain tumour are often the best source of support and information for others in similar situations. At our monthly BTSS Support Group meetings, we welcome new friends to share experiences and knowledge, ask question or simply chat with others who have been affected; and gain strength from being part of our community.
When do we meet?

Every second Saturday of the month 10.30 a.m. to 11.30 a.m.
We are open to meet new friends outside scheduled meetings when required",https://www.sgsocialsupport.com/resource/-Z8R4f4pw7J,No Content Found,Please contact the organisation for more details.,"Welcome and Introduction of BTSS and new members
Bonding Activities
Education (Sharing, Training, or Talks)",Who may attend? brain tumour patients survivors caregivers family members healthcare professionals or anyone with a passion for help the Brain Tumour community in Singapore.,"Brain Tumour Society Singapore + − Leaflet | OneMap © contributors | Singapore Land Authority Trio Building, Level 2 Drama Room, 11 Sam Leong Road 
S207903 Website",https://www.sgsocialsupport.com/resource/-Z8R4f4pw7J
Breast Cancer Support Group (BCF),"Each month, Breast Cancer Foundation of Singapore conducts support groups meetings that include sharing sessions, discussions on relevant subjects (e.g. exercise and nutrition, surgery and treatment journey).
Our support groups are exclusive for survivors and caregivers only.

English-Speaking Support Group (includes Malay, Indian &amp; Expats)
Mandarin-Speaking Support Group
Caregivers-Support Group (integrated with Men’s Support League)
Advanced &amp; Metastatic Breast Cancer Support Group
Young Women’s Support Group

Sessions are held on every 2nd Saturday of the month: 10am – 12pm",https://www.sgsocialsupport.com/resource/CA8wcKEvEWw,No Content Found,Support groups are exclusive for survivors and caregivers only.,Please contact the organisation for more details.,Please contact the organisation for more details.,Breast Cancer Foundation 6356 0123 membership@bcf.org.sg Website,https://www.sgsocialsupport.com/resource/CA8wcKEvEWw
Breast Cancer Support Group (NCCS),This group aims to address some of the common concerns and issues experienced by breast cancer patients,https://www.sgsocialsupport.com/resource/82DCK85N4Dc,No Content Found,Patients diagnosed with breast cancer.,Please contact the organisation for more details.,Please contact the organisation for more details.,Breast Cancer Support Group (NCCS) Website,https://www.sgsocialsupport.com/resource/82DCK85N4Dc
Breast Cancer Support Group (SGH),The Breast Cancer Support Group was formed in 1992 and now has about 30 former patients who volunteer to provide counselling and psychological support for breast cancer patients and their family members and caregivers. Members will also work closely with the Reach to Recovery Mastectomy Support Group of the Singapore Cancer Society to plan and facilitate programmes. The Breast Care Support Group meets monthly.,https://www.sgsocialsupport.com/resource/dvhnThuKFTw,No Content Found,Please contact the organisation for more details.,Please contact the organisation for more details.,Please contact the organisation for more details.,Breast Cancer Support Group (SGH) 6321 4474 Website,https://www.sgsocialsupport.com/resource/dvhnThuKFTw
Breast Care Support Group (CGH),"Breast Care Support Group
Thanks to more early recognition and better treatment options, breast cancer survival rates are constantly improving. It is important to us to accompany and support these patients in order to reduce suffering and improve the quality of life during and after their treatment.
The Breast Care Support Group aims to reach out to breast cancer patients who have been newly diagnosed with the condition and are currently undergoing treatment.
We hope that through various sharing by our multidisciplinary team (medical social workers, breast care nurses, physiotherapist, psychologist, dietitian and pharmacist) and support from group members, the journey breast cancer patients go through, can be more positive and enriching.
Time: Every last Saturday of the month from 0930hrs – 1100hrs from March to October 2019
Venue: Tutorial Rooms 1 and 2, Training Centre, Main Building
Activities

Helpful exercise
Healthy diet
Medication used in breast cancer treatment
Self-care activities
Self-awareness
Stress management
Enhance communication skills
Share and learn from one another",https://www.sgsocialsupport.com/resource/jE5FWj--ZWV,No Content Found,Please contact the organisation for more details.,Please contact the organisation for more details.,Please contact the organisation for more details.,Ms Aiyu/MSW 6850 1720 Website Sister Thai/Breast Centre 6936 6304 Website,https://www.sgsocialsupport.com/resource/jE5FWj--ZWV
Breast Support Group (NCIS),"The Breast Support Group is coordinated and facilitated by trained oncology nurses from the Oncology Nursing Division of the NCIS. Established in 2001, the group is made up of survivors, patients, their primary caregivers and NCIS nurses. It is open to patients affected by breast cancer.",https://www.sgsocialsupport.com/resource/3AEqwGzJR6g,No Content Found,Please contact the organisation for more details.,Please contact the organisation for more details.,Please contact the organisation for more details.,Breast Support Group (NCIS) ncis_survivorship@nuhs.edu.sg Website,https://www.sgsocialsupport.com/resource/3AEqwGzJR6g
Breastfeeding Mothers' Support Group,"BMSG’s vision is a vibrant and inclusive community of breastfeeding mothers who find emotional support, encouragement, companionship and information among like-minded peers in the organisation. BMSG also envisions a Singaporean community where breastfeeding is normalized as an essential part of society’s fabric.",https://www.sgsocialsupport.com/resource/GcTkxkUcZVY,No Content Found,Please contact the organisation for more details.,Please contact the organisation for more details.,Please contact the organisation for more details.,"Breastfeeding Mothers' Support Group + − Leaflet | OneMap © contributors | Singapore Land Authority SCWO, 96 Waterloo St, #02-04 
S187967 6339 3558 office@breastfeeding.org.sg Website",https://www.sgsocialsupport.com/resource/GcTkxkUcZVY
Burns Support Group (SGH),,https://www.sgsocialsupport.com/resource/yu4NxFVtTRr,No Content Found,Please contact the organisation for more details.,Please contact the organisation for more details.,Please contact the organisation for more details.,Burns Support Group (SGH) Website,https://www.sgsocialsupport.com/resource/yu4NxFVtTRr
Cardiac Arrest Survivors’ Club (Singapore Heart Foundation),"The Cardiac Arrest Survivors’ Club is a support group for cardiac arrest survivors and their caregivers. We aim to provide a safe space that supports cardiac arrest survivors rebuild their lives. We are a peer-led support group for survivors, by survivors. We host a variety of activities, including discussions, nature walks, makan sessions and much more.Our partners include the Singapore Heart Foundation, Duke-NUS Medical School, UPEC, SingHealth and SCDF.",https://www.sgsocialsupport.com/resource/wYMXVrfGALS,No Content Found,Please contact the organisation for more details.,Please contact the organisation for more details.,Please contact the organisation for more details.,Cardiac Arrest Survivors’ Club (Singapore Heart Foundation) survivors@heart.org.sg Website,https://www.sgsocialsupport.com/resource/wYMXVrfGALS
CARe Programme (NNI),"The Dementia Support Group is organised by the National Neuroscience Institute (NNI) CARe team. It is intended for care partners who are taking care of people with young onset dementia. The dementia-related topics will be conducted in English.
The support group aims to equip care partners with information to understand more about dementia. Through this, care partners will be able to provide better support to the people with the condition. In these sessions, participants will be able to share their experiences and tips with fellow care partners.",https://www.sgsocialsupport.com/resource/N59bggHYXzc,No Content Found,Please contact the organisation for more details.,Please contact the organisation for more details.,Please contact the organisation for more details.,"NNI 9656 8078 mei_mei_nyu@nni.com.sg Website NNI @ SGH Singapore General Hospital
Outram Road
Singapore 169608 Monday to Friday: 8.00am to 6.00pm
Saturday: 8.00am to 1.00pm
Sunday, Public Holidays: Closed 6321 4377 appointments@sgh.com.sg NNI @ TTSH National Neuroscience Institute
11 Jalan Tan Tock Seng
Singapore 308433 Monday to Wednesday, Friday: 8.00am to 5.30pm
Thursday: 8.00am to 5.00pm
Saturday, Sunday, Public Holidays: Closed 6330 6363 appointments@nni.com.sg",https://www.sgsocialsupport.com/resource/N59bggHYXzc
Caregiver Support - ABLE,ABLE’s Respite Centre supports family caregivers through providing regular quality programmes and services for both caregivers and care recipients.&nbsp;ABLE’s support groups play an important role in engaging caregivers and providing respite from caregiving duties. We also host annual family caregiver retreats and appreciation events to acknowledge the individuals caring for the physically challenged. These activities are conducted to give caregivers a sense of community and to bond through shared experiences.&nbsp;,https://www.sgsocialsupport.com/resource/wPf2xaHtkSb,No Content Found,Please contact the organisation for more details.,"Respite Services for Caregivers ABLE’s  programmes and services aim to support family caregivers through a Family Centric approach. The care recipient has to be first taken care of by professionals before the family caregiver is able to consider seeking respite. We support family caregivers and their physically challenged care recipients with centre- based  programmes. These programmes are run by ABLE’s Programme and Healthcare teams and trained volunteers. Support Groups Our family caregivers experience respite through self-enrichment workshops, information talks and interest groups. Through these programmes, the caregivers are given opportunities to discover and explore their own interests. As family caregivers interact with each other during programmes and activities, they have an opportunity to form informal support and social networks which would help boost their own resilience in the face of caregiving difficulties. Family Caregiver Toolkit Interested to find out more about caregiving and locate the resources to help? Kindly drop us an email at enquiries@able-sg.org to gain access to ABLE’s Family Caregiver Toolkit.","To apply for ABLE’s caregiver support programmes, please download the registration form and submit the completed form by email to enquiries@able-sg.org .","ABLE + − Leaflet | OneMap © contributors | Singapore Land Authority 7A Lorong 8 Toa Payoh, #02-09 Agape Village 
S319264 6801 7460 enquiries@able-sg.org Website",https://www.sgsocialsupport.com/resource/wPf2xaHtkSb
Caregiver Support Group (Care Corner),"Caregiver Support Group 
Through monthly support group sessions and respite programmes, caregivers learn tips on caregiving and receive emotional support in their caregiving journey
Monthly Support Group Sessions — ‘Journeying Together’
Caregivers meet monthly to share on a variety of topics. Examples of topics include:

Advanced care planning
Lasting power of attorney
Engagement and reminiscence with persons living with dementia
Improving home environments for persons living with dementia

Each session lasts 1.5 hours and is held either in-person or online. Sessions are held bilingually in English and Mandarin. These sessions are free of charge.",https://www.sgsocialsupport.com/resource/TQb42qBWqYU,No Content Found,Please contact the organisation for more details.,Please contact the organisation for more details.,Please contact the organisation for more details.,"Care Corner + − Leaflet | OneMap © contributors | Singapore Land Authority Blk 62B Lor 4 Toa Payoh #02-121 
S312062 6258 6601 tp.cs@carecorner.org.sg Website",https://www.sgsocialsupport.com/resource/TQb42qBWqYU
