Content,Source URL
"Catergory: CHILDREN & YOUTH FINANCIAL SUPPORT ITE Special Student Assistance Scheme (SSAS) One-off financial assistance to help students tide over short-term financial difficulties. SCHEME HIGHLIGHTS One-off financial assistance from $100 to $400 Apply online via the ITE portal. Click on iStudent icon > Financial Assistance icon. Apply now Expand all sections What are the benefits? One-off financial assistance from $100 to $400 The amount will depend on the needs of each individual student Who is eligible? How to apply? Where can I find help? Scheme last updated 01 Aug 2021  Last updated 19 May 2024, 5:03:26 pm.",https://supportgowhere.life.gov.sg/schemes/SSAS/ite-special-student-assistance-scheme-ssas
"Catergory: CHILDREN & YOUTH HEALTH & MEDICAL Vaccination and Childhood Developmental Screening Subsidies Provides subsidised vaccinations and Childhood Development Screenings (CDS) at polyclinics and/or CHAS GP clinics to eligible Singapore Citizens and Permanent Residents. SCHEME HIGHLIGHTS Subsidies of up to $125 at CHAS GP Clinics for nationally-recommended vaccinations Subsidies of up to 75% at polyclinics for nationally-recommended vaccinations Subsidies for Childhood Development Screenings Expand all sections What are the benefits? Subsidies of between $35 to $125 for nationally-recommended vaccinations administered at CHAS GP clinics Up to 75% subsidy for National Adult Immunisation Schedule (NAIS) vaccinations at polyclinics Pioneer Generation and Merdeka Generation seniors will also receive an additional 50% and 25% subsidy from their subsidised vaccination bills respectively Full subsidy for childhood developmental screening at both CHAS GP clinics and polyclinics Who is eligible? How to apply? Where can I find help? Scheme last updated 01 Aug 2021  Last updated 19 May 2024, 5:03:26 pm.",https://supportgowhere.life.gov.sg/schemes/VCDSS/vaccination-childhood-developmental-screening-subsidies
"Catergory: WORK & LEARNING Skills & Training Advisory Services Receive personalised advice on your skills and training needs through one-to-one consultations with Skills Ambassadors. SCHEME HIGHLIGHTS Discover emerging trends across different sectors and insights on in-demand skills and jobs Expand all sections What are the benefits? A free 30 to 45 minute 1-to-1 personalised consultation with a Skills Ambassador to identify: Your skills and training needs to achieve your career goals Skills required to support your career transition or progression Suitable courses and course providers that cater to your needs The various assistance schemes to support your skills upgrading efforts Who is eligible? How to apply? Where can I find help? Scheme last updated 01 Jun 2021  Last updated 19 May 2024, 5:03:26 pm.",https://supportgowhere.life.gov.sg/schemes/SKILLS-ADVISORY/skills-and-training-advisory-services
"Catergory: WORK & LEARNING Critical Core Skills (CCS) Provides information on the essential skills across 3 skills clusters for employability and career development. SCHEME HIGHLIGHTS Includes 16 competencies across 3 skill clusters Supports employability by aiding in the acquisition of technical skills and competencies SkillsFuture Singapore (SSG) has appointed 13 Approved Training Organisations (ATOs) to deliver CCS-aligned modular training programmes Expand all sections What are the benefits? Enhances employability and career development through 16 competencies across 3 skill clusters: Thinking Critically, Interacting with Others, and Staying Relevant Supports career mobility by providing strategies, direction, and motivation for ongoing technical skill development Who is eligible? How to apply? Where can I find help? Scheme last updated 21 May 2024  Last updated 19 May 2024, 5:03:26 pm.",https://supportgowhere.life.gov.sg/schemes/CRICORESK/critical-core-skills-ccs
"Catergory: WORK & LEARNING Education and Career Guidance (ECG) Support students or adults in early or mid-career phase in making informed education and career decisions at various life stages. SCHEME HIGHLIGHTS ECG Counselling available in secondary schools, junior colleges, Millennia Institute, and post-secondary education institutions MySkillsFuture portal offers self-assessment tools and resources for students and adults SkillsFuture Skills and Training Advisory Services provide guidance to identify skills and training needs Expand all sections What are the benefits? Guidance to develop strengths, interests, and abilities for meaningful contributions to society Tools to explore various education and career pathways for continuous learning and advancement Who is eligible? How to apply? Where can I find help? Scheme last updated 21 May 2024  Last updated 19 May 2024, 5:03:26 pm.",https://supportgowhere.life.gov.sg/schemes/ECG/education-career-guidance-ecg
"Catergory: WORK & LEARNING Jobs-Skills Integrators Targeted at companies building industry-relevant skills and individuals seeking relevant jobs and skills matches. SCHEME HIGHLIGHTS Pilot for Jobs-Skills Integrator in Precision Engineering, Retail, and Wholesale Trade sectors Employers gain access to training courses and skilled jobseekers Individuals receive careers advisory and job matching services Expand all sections What are the benefits? For Individuals: Training courses with integrated career services that can equip you with in-demand skills to help you transit into or within the sector Sector-specific career advisory services and job matching support, including opportunities that will enhance your career prospects Careers advisory for employees to explore development opportunities within the company or sector A central point of contact for referrals to training and job matching services For Employers: Tailored training courses to meet the specific skills needs of your workforce Access to job seekers with the necessary skills ready to start careers in targeted sector Who is eligible? How to apply? Where can I find help? Scheme last updated 21 May 2024  Last updated 19 May 2024, 5:03:26 pm.",https://supportgowhere.life.gov.sg/schemes/JOBSKLINT/jobs-skills-integrators
"Catergory: WORK & LEARNING Singapore Workforce Skills Qualifications A national credential system that trains, develops, assesses and certifies skills and competencies for the workforce. SCHEME HIGHLIGHTS WSQ is a national credential system for skills and competencies certification No academic prerequisites required for entry, recognises prior work experience and credentials Expand all sections What are the benefits? Acquire job role-specific skills and competencies through competency-based training Gain portable credentials to improve employability and mobility Access to bite-sized modules leading to Statements of Attainment and full WSQ qualifications Quality assured qualifications awarded by SkillsFuture Singapore or in partnership with established awarding bodies Who is eligible? How to apply? Where can I find help? Scheme last updated 21 May 2024  Last updated 19 May 2024, 5:03:26 pm.",https://supportgowhere.life.gov.sg/schemes/SGWSQ/singapore-workforce-skills-qualifications
"Catergory: WORK & LEARNING SkillsFuture Fellowships Awards a $10,000 monetary award to support skills mastery for eligible Singapore Citizens. SCHEME HIGHLIGHTS Receive $10,000 to continue your learning journey Open to Singapore Citizens with at least 10 years of working experience in the same (or related) industry or job function Expand all sections What are the benefits? Monetary award of $10,000 for skills mastery and lifelong learning National recognition by the President of the Republic of Singapore Opportunities to inspire and mentor future talent Who is eligible? How to apply? Where can I find help? Scheme last updated 21 May 2024  Last updated 19 May 2024, 5:03:26 pm.",https://supportgowhere.life.gov.sg/schemes/SFFELLOW/skillsfuture-fellowships
"Catergory: WORK & LEARNING SkillsFuture for Digital Workplace Equips Singapore Citizen adults with essential digital skills for the evolving digital economy. SCHEME HIGHLIGHTS Develop a deep understanding of critical digital competencies for the evolving economy Safely navigate technology-rich environments with cybersecurity awareness Master various digital tools, including nationally recognized platforms, for strategic data utilization Expand all sections What are the benefits? Navigate technology-rich environments with awareness of cybersecurity risks, ensuring secure work practices Acquire proficiency in diverse digital applications and tools, including nationally recognized platforms, while understanding the strategic use of data and information Gain insights into essential jobs and digital skills needed in today's and tomorrow's digital economy Who is eligible? How to apply? Where can I find help? Scheme last updated 21 May 2024  Last updated 19 May 2024, 5:03:26 pm.",https://supportgowhere.life.gov.sg/schemes/SFDWP/skillsfuture-digital-workplace
"Catergory: WORK & LEARNING SkillsFuture Leadership Development Initiative Provides leadership development opportunities for eligible Singapore Citizens to become future business leaders. SCHEME HIGHLIGHTS Develop critical leadership competencies through sectoral leadership programmes Join the SG Leaders Network to connect with other leaders Expand all sections What are the benefits? Gain critical leadership competencies and experiences through corporate leadership programmes Who is eligible? How to apply? Where can I find help? Scheme last updated 21 May 2024  Last updated 19 May 2024, 5:03:26 pm.",https://supportgowhere.life.gov.sg/schemes/SFLEADDEV/skillsfuture-leadership-development-initiative
"Catergory: WORK & LEARNING SkillsFuture Mid-Career Enhanced Subsidy Provides up to 90% subsidy on course fees for Singapore Citizens aged 40 and above. SCHEME HIGHLIGHTS Up to 90% subsidy on course fees for Singapore Citizens aged 40 and above At least 90% subsidy on programme costs for MOE-subsidised courses at institutions like Autonomous Universities, Polytechnics, and ITE Expand all sections What are the benefits? Up to 90% subsidy on course fees for courses offered by SkillsFuture Singapore (SSG)-appointed Continuing Education and Training (CET) Centres At least 90% subsidy on programme costs for Ministry of Education (MOE)-subsidised full-time and part-time courses at institutions like Autonomous Universities, Polytechnics, and the Institute of Technical Education For certifiable-skills training courses, up to 70% subsidy on course fees Who is eligible? How to apply? Where can I find help?  Scheme last updated 21 May 2024  Last updated 19 May 2024, 5:03:26 pm.",https://supportgowhere.life.gov.sg/schemes/SFMCES/skillsfuture-mid-career-enhanced-subsidy
"Catergory: WORK & LEARNING SkillsFuture Series Provides short, industry-relevant training for in-demand skills in Care, Digital, Green, and Industry 4.0 sectors. SCHEME HIGHLIGHTS Offers short, industry-relevant training programmes Focus on emerging skills in Care, Digital, Green, and Industry 4.0 sectors Training across Basic, Intermediate, and Advanced levels for different proficiencies Expand all sections What are the benefits? Training across Basic, Intermediate, and Advanced levels to match different skill proficiencies Acquire foundational or advanced skills to boost career prospects and enhance employability Who is eligible? How to apply? Where can I find help? Scheme last updated 21 May 2024  Last updated 19 May 2024, 5:03:26 pm.",https://supportgowhere.life.gov.sg/schemes/SFSERIES/skillsfuture-series
"Catergory: WORK & LEARNING SkillsFuture Work-Study Certificate Provides industry-relevant skills and knowledge related to discipline of study through a work-study arrangement for individuals. SCHEME HIGHLIGHTS Receive a sign-on incentive of S$5,000 Acquire relevant work experience and skills valued by the industry Potential for skills-based wage increments and career advancement upon completion Expand all sections What are the benefits? Full-time employment with a competitive starting salary Industry-recognised certificate upon completion Sign-on incentive of S$5,000 Potential for skills-based wage increments and career advancement based on performance Who is eligible? How to apply? Where can I find help? Scheme last updated 21 May 2024  Last updated 19 May 2024, 5:03:26 pm.",https://supportgowhere.life.gov.sg/schemes/SFWKSTCERT/skillsfuture-work-study-certificate
"Catergory: WORK & LEARNING SkillsFuture Work-Study Degree Provides work-relevant skills through on-the-job training and classroom learning for students and working adults. SCHEME HIGHLIGHTS Structured on-the-job training with classroom learning Tuition fee sponsorship, stipends, and potential sign-on bonuses from sponsoring companies Opportunity for career offers from sponsoring companies upon graduation Expand all sections What are the benefits? Gain work-relevant skills through a blend of classroom learning and structured on-the-job training Receive financial support from sponsoring companies, which may include tuition fee sponsorship, stipends, and sign-on bonuses Opportunities for career advancement with the sponsoring company after graduation Flexible study modes with Term-in/Term-out or Work-day/Study-day options Who is eligible? How to apply? Where can I find help? Scheme last updated 21 May 2024  Last updated 19 May 2024, 5:03:26 pm.",https://supportgowhere.life.gov.sg/schemes/SFWKSTDEG/skillsfuture-work-study-degree
"Catergory: WORK & LEARNING SkillsFuture Work-Study Diploma Provides a head-start in career related to discipline of study for eligible fresh Institute of Technical Education (ITE) graduates. SCHEME HIGHLIGHTS Receive a sign-on incentive of $5,000 for eligible fresh graduates Competitive starting salary and full-time employment with participating companies Attain an industry-recognised Diploma-level qualification Expand all sections What are the benefits? Competitive starting salary and full-time employment with participating companies Structured on-the-job training and mentorship over 12 to 36 months Attainment of an industry-recognised Diploma-level qualification Sign-on incentive of $5,000 for eligible fresh graduates Potential for wage increments and career advancement based on performance Who is eligible? How to apply? Where can I find help? Scheme last updated 21 May 2024  Last updated 19 May 2024, 5:03:26 pm.",https://supportgowhere.life.gov.sg/schemes/SFWKSTDIP/skillsfuture-work-study-diploma
"Catergory: WORK & LEARNING SkillsFuture Work-Study Post-Diploma Provides a $5,000 sign-on incentive and industry-recognised qualifications for eligible fresh Polytechnic graduates. SCHEME HIGHLIGHTS Receive a sign-on incentive of $5,000 for eligible fresh Polytechnic graduates Competitive starting salary and full-time employment with participating companies Attain an industry-recognised Post-Diploma qualification or professional certification Expand all sections What are the benefits? Competitive starting salary with full-time employment at participating companies Attain an industry-recognised Post-Diploma qualification or professional certification $5,000 sign-on incentive for eligible fresh Polytechnic graduates Potential for skills-based wage increments and career advancement upon programme completion Who is eligible? How to apply? Where can I find help? Scheme last updated 21 May 2024  Last updated 19 May 2024, 5:03:26 pm.",https://supportgowhere.life.gov.sg/schemes/SFWKSTPDIP/skillsfuture-work-study-post-diploma
"Catergory: DISABILITY SUPPORT FINANCIAL SUPPORT CareShield Life Provides basic financial support for Singaporeans who become severely disabled, especially during old age, and need long-term care. SCHEME HIGHLIGHTS Monthly payouts start at $624 in 2022 and increase over time Apply through AIC's eService Portal (eFASS) Apply now Expand all sections What are the benefits? Lifetime cash payouts as long as you remain severely disabled Increasing monthly payouts, starting at $624 in 2022 and increases annually until age 67 or when a successful claim is made, whichever is earlier Who is eligible? How to apply? Where can I find help? Scheme last updated 20 May 2024  Last updated 19 May 2024, 5:03:26 pm.",https://supportgowhere.life.gov.sg/schemes/CARESHIELD/careshield-life
"Catergory: DISABILITY SUPPORT FINANCIAL SUPPORT ElderFund Provides monthly cash supplement to severely disabled lower-income Singapore Citizens, who are not able to benefit from other schemes, and have low MediSave balances and inadequate personal savings to meet their long-term care needs. SCHEME HIGHLIGHTS Up to $250 cash per month Apply now Expand all sections What are the benefits? Eligible Singapore Citizens can receive up to $250 cash per month for as long as they remain eligible, and meet the terms and conditions needed for receipt of payment. Who is eligible? How to apply? Where can I find help? Scheme last updated 20 May 2024  Last updated 19 May 2024, 5:03:26 pm.",https://supportgowhere.life.gov.sg/schemes/ELDERFUND/elderfund
"Catergory: DISABILITY SUPPORT FINANCIAL SUPPORT ElderShield Provides basic financial support to those who become severely disabled, especially during old age, and need long-term care. SCHEME HIGHLIGHTS Receive up to $400 per month for up to 5 or 6 years Expand all sections What are the benefits? Monthly cash payouts of $300 or $400 for up to 5 or 6 years upon severe disability, depending on the plan. Who is eligible? How to apply? Where can I find help? Scheme last updated 20 May 2024  Last updated 19 May 2024, 5:03:26 pm.",https://supportgowhere.life.gov.sg/schemes/ELDERSHIELD/eldershield
"Catergory: DISABILITY SUPPORT FINANCIAL SUPPORT SENIORS Interim Disability Assistance Scheme (IDAPE) Provides monthly cash supplement for elderly Singapore Citizen with disabilities and who is not eligible for ElderShield due to age criteria or had pre-existing disabilities. SCHEME HIGHLIGHTS Receive $150 or $250 monthly cash payout for up to 72 months Processing time takes up to 8 weeks Apply through AIC‚Äôs eService portal (eFASS) Apply now Expand all sections What are the benefits? For seniors who develop severe disabilities, they can receive $150 or $250 monthly cash payout (depending on their financial circumstances) for up to 72 months. Who is eligible? How to apply? Where can I find help? Scheme last updated 20 May 2024  Last updated 19 May 2024, 5:03:26 pm.",https://supportgowhere.life.gov.sg/schemes/IDAPE/interim-disability-assistance-scheme-idape
"Catergory: DISABILITY SUPPORT FINANCIAL SUPPORT MediSave Care Allows severely disabled Singaporeans to make monthly cash withdrawals from their own and/or their spouse‚Äôs MediSave Account for long-term care. SCHEME HIGHLIGHTS Withdraw up to $200 per month Apply through AIC's eService Portal (eFASS), or in person at AIC Link offices Apply now Expand all sections What are the benefits? Withdraw up to $200 per month from your own and/or your spouse's MediSave Account for long-term care. Withdrawal amounts are dependent on the care recipient and/or their spouse‚Äôs MediSave Account balance Who is eligible? How to apply? Where can I find help? Scheme last updated 20 May 2024  Last updated 19 May 2024, 5:03:26 pm.",https://supportgowhere.life.gov.sg/schemes/MEDISAVE_CARE/medisave-care
"Catergory: WORK & LEARNING Career Guidance (Polaris) Polaris is a suite of personalised career guidance programmes by Workforce Singapore (WSG) and its appointed providers, Ingeus and Angus Knight (AKG, formerly known as Maximus). The Polaris career guidance programmes are designed for employed individuals who want to elevate their careers through career planning. SCHEME HIGHLIGHTS Polaris programmes by Ingeus and AKG have a nominal fee of either $40 or $90 (subject to GST) depending on the programme content and duration. Fees for Polaris by WSG will be announced later Programmes range from two weeks to three months in duration Expand all sections What are the benefits? Personalised career guidance by a certified career coach to help you make informed career decisions Tailored Career Development Plan to support your professional growth Who is eligible? How to apply? Where can I find help? Scheme last updated 08 May 2024  Last updated 19 May 2024, 5:03:26 pm.",https://supportgowhere.life.gov.sg/schemes/CGPOLARIS/career-guidance-polaris
"Catergory: WORK & LEARNING Career Trial for Jobseekers Encourages jobseekers and host companies who are unsure about the job fit to engage in a short-term trial before considering formal employment. SCHEME HIGHLIGHTS Receive a training allowance of $7.50 to $15.00 per hour during the career trial period Retention incentive of $500 for 3 months post-trial, and $1,000 for 6 months post-trial, depending on eligibility Apply now Expand all sections What are the benefits? Training Allowance (TA) ranging from $7.50 to $15.00 per hour during the trial period Retention Incentive (RI) of $500 for staying employed for 3 months post-trial Additional Retention Incentive (ARI) of $1,000 for staying employed for 6 months post-trial, subject to additional criteria Who is eligible? How to apply? Where can I find help? Scheme last updated 08 May 2024  Last updated 19 May 2024, 5:03:26 pm.",https://supportgowhere.life.gov.sg/schemes/CAREERTJS/career-trial-jobseekers
"Catergory: WORK & LEARNING DISABILITY SUPPORT Employment Support for Persons with Disabilities Enhances the employability of, and increases employment options for, Persons with Disabilities (PWDs) by providing access to career advisory services, training courses, and post-placement job support. Administered by SG Enable. SCHEME HIGHLIGHTS Career advisory services to help establish job readiness, and identify training and career options Course fee subsidies of up to 95% for SG Enable‚Äôs list of curated training courses Received training allowance of $6 per hour, and training commitment award of $100 per completed course Expand all sections What are the benefits? Career advisory services to help determine job readiness and explore career pathways Up to 95% subsidy on course fees for SG Enable‚Äôs list of curated training courses Training allowance at $6 per hour for course duration Training commitment award of $100 for each completed course Who is eligible? How to apply? Where can I find help? Scheme last updated 08 May 2024  Last updated 19 May 2024, 5:03:26 pm.",https://supportgowhere.life.gov.sg/schemes/EMPSUPPWD/employment-support-persons-disabilities
"Catergory: WORK & LEARNING SENIORS Employment Support for Seniors Provides career advisory and job-matching services for senior jobseekers aged 50 and above. Administered by Centre for Seniors (CFS). SCHEME HIGHLIGHTS Career advisory services to assess job readiness and explore career options Job-matching services to access job opportunities Expand all sections What are the benefits? Career advisory services to help seniors establish job readiness and identify possible training and career options Job-matching services to gain access to meaningful job opportunities from forward-thinking organisations Who is eligible? How to apply? Where can I find help? Scheme last updated 08 May 2024  Last updated 19 May 2024, 5:03:26 pm.",https://supportgowhere.life.gov.sg/schemes/EMPSUPSN/employment-support-seniors
"Catergory: WORK & LEARNING Job Opportunities (Yellow Ribbon) Provides career support and job access to help ex-offenders reintegrate into the workforce. Administered by Yellow Ribbon Singapore (YRSG). SCHEME HIGHLIGHTS Career advisory services to increase access to employment opportunities Prepares unemployed ex-offenders to re-enter the workforce Career retention support to ease re-integration and stay in employment Expand all sections What are the benefits? Career advisory services to guide ex-offenders in finding suitable employment and improved access to employment opportunities Prepares unemployed ex-offenders to re-enter the workforce Provides ex-offenders with career retention support to ease re-integration and stay in employment Who is eligible? How to apply? Where can I find help? Scheme last updated 08 May 2024  Last updated 19 May 2024, 5:03:26 pm.",https://supportgowhere.life.gov.sg/schemes/JOBOPPYR/job-opportunities-yellow-ribbon
"Catergory: WORK & LEARNING volunteer Career Advisors initiative Helps individuals tap volunteer Career Advisors‚Äô industry experience for sector- and occupation-specific career advice and connect with Government programmes and services. SCHEME HIGHLIGHTS Get sector-specific career advice from industry veterans and connected to government programme and services Gain insights into industry trends and skills Expand all sections What are the benefits? For advisor: Opportunity to share occupational/industry insights, to guide and positively impact other‚Äôs career path. Act as the last-mile connection to relevant government programmes and services. For advisee: Get sector- and occupation-specific career advice from industry veterans Access insights into industry trends and skills to inform career decisions Who is eligible? How to apply? Where can I find help? Scheme last updated 08 May 2024  Last updated 19 May 2024, 5:03:26 pm.",https://supportgowhere.life.gov.sg/schemes/VCADVINI/volunteer-career-advisors-initiative
